[
  {
    "url": "https://sacombank-sbj.com/blogs/bang-gia-bac/bang-ty-gia-bac-ngay-22-11-2025-bang-1",
    "title": "Bảng Tỷ Giá Bạc - Ngày 22/11/2025 - Bảng 1",
    "date": "2025-11-22",
    "silver_type": "Bạc Miếng Kim-Phúc-Lộc SBJ 999 iuro‘ng",
    "buy": 1908000,
    "sell": 1959000,
    "effective_time": "10:15",
    "image_url": "https://cdn.hstatic.net/200000315699/file/hinh_anh_22-11-25_luc_10.09_54dc950cdb1b4b07a7413ab7556856f8.jpeg",
    "ocr_text": "sacombank-sbj m s6: bm.qdtg.02a\ncong ty vang bag 2a auy conned, poe\nbang gia bac\nhiéu lure tir: 10h15 don vj tinh: vnd/luro‘ng\nloni bac [ciawua_ciaban\nbac miéng kim-phtic-léc sbj 999 1 iuro‘ng 1.908.000 1.959.000",
    "crawled_at": "2025-11-22T16:15:42.098938Z"
  },
  {
    "url": "https://sacombank-sbj.com/blogs/bang-gia-bac/bang-ty-gia-bac-ngay-21-11-2025-bang-8",
    "title": "Bảng Tỷ Giá Bạc - Ngày 21/11/2025 - Bảng 8",
    "date": "2025-11-21",
    "silver_type": "Bạc Miếng Kim-Phúc-Lộc SBJ 999 1 lượng",
    "buy": 1881000,
    "sell": 1932000,
    "effective_time": "17:05",
    "image_url": "https://cdn.hstatic.net/200000315699/file/l8_48df232ef04b4596bfb0976f6fdded8f.png",
    "ocr_text": "sacombank-sbj mas: bm.qdtg.02a\ncong ty vang bac da quy\nban hanh: ( / /2025)\n‘s odaeseness\nbang gia bac\nhiéu luce tir: 17h05 don vi tinh: vnd/luong\nloa bag cima [cia pan\nbac miéng kim-phie-léc sbj 999 1 ludng 1.881.000 1.932.000",
    "crawled_at": "2025-11-22T16:15:43.623343Z"
  },
  {
    "url": "https://sacombank-sbj.com/blogs/bang-gia-bac/bang-ty-gia-bac-ngay-21-11-2025-bang-7",
    "title": "Bảng Tỷ Giá Bạc - Ngày 21/11/2025 - Bảng 7",
    "date": "2025-11-21",
    "silver_type": "Bạc Miếng Kim-Phúc-Lộc SBJ 999 1 lượng",
    "buy": 1884000,
    "sell": 1935000,
    "effective_time": "15:50",
    "image_url": "https://cdn.hstatic.net/200000315699/file/l7_53f91c90d2074f798bbaa81f104e7243.png",
    "ocr_text": "sacombank-sbj m4 86: bm.qdtg.02a\nban hanh: ( / /2025)\ns6::\nbang gia bac\nhiéu luc ta: 15h50 bon vj tinh: vnd/lugng\nloalbac ff cumua | ciaean\nbac miéng kim-phiic-léc sbj 999 1 lung 1.884.000 1.935.000",
    "crawled_at": "2025-11-22T16:15:46.764157Z"
  },
  {
    "url": "https://sacombank-sbj.com/blogs/bang-gia-bac/bang-ty-gia-bac-ngay-21-11-2025-bang-6",
    "title": "Bảng Tỷ Giá Bạc - Ngày 21/11/2025 - Bảng 6",
    "date": "2025-11-21",
    "silver_type": "Bạc Miếng Kim-Phúc-Lộc SBJ 999 1 lượng",
    "buy": 1878000,
    "sell": 1929000,
    "effective_time": "15:25",
    "image_url": "https://cdn.hstatic.net/200000315699/file/l6_0b7c8689a9d64610bd79ac219c553be7.png",
    "ocr_text": "sacombank-sbj\ns6::\nbang gia bac\nbang: 06 ngdy 21/11/2025\nhiéu lye ti: 15h25\nmi s6: bm.qdtg.02a\nban hanh: ( / /2025)\nbon vi tinh: vnd/luong\nloalbac ff cumua | ciaean\nbac miéng kim-phic-léc sbj 999 1 lugng\n1.878.000\n1.929.000",
    "crawled_at": "2025-11-22T16:15:47.943062Z"
  },
  {
    "url": "https://sacombank-sbj.com/blogs/bang-gia-bac/bang-ty-gia-bac-ngay-21-11-2025-bang-5",
    "title": "Bảng Tỷ Giá Bạc - Ngày 21/11/2025 - Bảng 5",
    "date": "2025-11-21",
    "silver_type": "Bạc Miếng Kim-Phúc-Lộc SBJ 999 1 lượng",
    "buy": 1884000,
    "sell": 1935000,
    "effective_time": "14:18",
    "image_url": "https://cdn.hstatic.net/200000315699/file/l5_257f93ca3ed4435eb0a41fb65e53a927.png",
    "ocr_text": "sacombank-sbj\ncong ty vang bac ba quy\nbang gia bac\nbang: 05 ngay 21/11/2025\nhiéu luc ta: 14h18\nm 86: bm.qdtg.02a\nban hanh: ( / /2025)\ndon vj tinh: vnd/lugng\nab fcrmua [cia ban\nbac miéng kim-phic-léc sbj 999 1 ludng\n1.884.000\n1.935.000",
    "crawled_at": "2025-11-22T16:15:49.606301Z"
  },
  {
    "url": "https://sacombank-sbj.com/blogs/bang-gia-bac/bang-ty-gia-bac-ngay-21-11-2025-bang-4",
    "title": "Bảng Tỷ Giá Bạc - Ngày 21/11/2025 - Bảng 4",
    "date": "2025-11-21",
    "silver_type": "Bạc Miếng Kim-Phúc-Lộc SBJ 999 1 lượng",
    "buy": 1896000,
    "sell": 1947000,
    "effective_time": "17:15",
    "image_url": "https://cdn.hstatic.net/200000315699/file/l4_9ed788ca0a884ef78e81db0cd7c7f22e_master.png",
    "ocr_text": "sacombank- sbj mg s6: bm.qdtg.02a\ncong ty vang bac da quy\nban hanh: ( / /2025)\nbang gia bac\nhiéu lue fu: 17h15 bon vj tinh: vnb/luong\nloal bac ciamua | giaban\nbac miéng kim-phiic-l6c sbj 999 1 luong 1,896,000 1,947,000",
    "crawled_at": "2025-11-22T16:15:56.667351Z"
  },
  {
    "url": "https://sacombank-sbj.com/blogs/bang-gia-bac/bang-ty-gia-bac-ngay-21-11-2025-bang-3",
    "title": "Bảng Tỷ Giá Bạc - Ngày 21/11/2025 - Bảng 3",
    "date": "2025-11-21",
    "silver_type": "Bạc Miếng Kim-Phúc-Lộc SBJ 999 1 lượng",
    "buy": 1902000,
    "sell": 1953000,
    "effective_time": "10:20",
    "image_url": "https://cdn.hstatic.net/200000315699/file/l3_1b7a6d58b94648c28e6d72894cb74e22.png",
    "ocr_text": "sacombank-sbj\nbang gia bac\nbang: 03 ngdy 21/11/2025\nhiéu lye ti: 10h20\nmi s6: bm.qdtg.02a\nban hanh: ( / /2025)\nbon vi tinh: vnd/luong\nloalbac ff cumua | ciaean\nbac miéng kim-phic-léc sbj 999 1 lugng\n1.902.000\n1.953.000",
    "crawled_at": "2025-11-22T16:16:02.947747Z"
  },
  {
    "url": "https://sacombank-sbj.com/blogs/bang-gia-bac/bang-ty-gia-bac-ngay-21-11-2025-bang-2",
    "title": "Bảng Tỷ Giá Bạc - Ngày 21/11/2025 - Bảng 2",
    "date": "2025-11-21",
    "silver_type": "Bạc Miếng Kim-Phúc-Lộc SBJ 999 1 lượng",
    "buy": 1923000,
    "sell": 1974000,
    "effective_time": "08:25",
    "image_url": "https://cdn.hstatic.net/200000315699/file/l2_aaeeb573856a4a7988aacc88b5e4ace5.png",
    "ocr_text": "sacombank-sbj\nbang gia bac\nbang: 02 ngdy 21/11/2025\nhiéu lye ti: o8h25\nmi s6: bm.qdtg.02a\nban hanh: ( / /2025)\nbon vi tinh: vnd/luong\nloalbac ff cumua | ciaean\nbac miéng kim-phic-léc sbj 999 1 lugng\n1.923.000\n1.974.000",
    "crawled_at": "2025-11-22T16:16:04.074923Z"
  },
  {
    "url": "https://sacombank-sbj.com/blogs/bang-gia-bac/bang-ty-gia-bac-ngay-21-11-2025-bang-1",
    "title": "Bảng Tỷ Giá Bạc - Ngày 21/11/2025 - Bảng 1",
    "date": "2025-11-21",
    "silver_type": "Bạc Miếng Kim-Phúc-Lộc SBJ 999 lu’o‘ng",
    "buy": 1941000,
    "sell": 1992000,
    "effective_time": "07:30",
    "image_url": "https://cdn.hstatic.net/200000315699/file/hinh_anh_21-11-25_luc_07.19_1f6e2bba07414c7dac0e662e8beeb2e0.jpeg",
    "ocr_text": "sacombank-sbj m6: bm.qdtg.02a\ncona ty vang! 846 64 auy eee 2026)\nbang gia bac\nhiéu lure tir: 07h30 don vj tinh: vnd/uorng\nloni bac [ciawua j ciaban\nbac miéng kim-phtic-léc sbu 999 1 lu’o‘ng 1.941.000 1.992.000",
    "crawled_at": "2025-11-22T16:16:05.533987Z"
  },
  {
    "url": "https://sacombank-sbj.com/blogs/bang-gia-bac/bang-ty-gia-bac-ngay-20-11-2025-bang-7",
    "title": "Bảng Tỷ Giá Bạc - Ngày 20/11/2025 - Bảng 7",
    "date": "2025-11-20",
    "silver_type": "Bạc Miếng Kim-Phúc-Lộc SBJ 999 1 lượng",
    "buy": 1935000,
    "sell": 1986000,
    "effective_time": "16:30",
    "image_url": "https://cdn.hstatic.net/200000315699/file/l7_8fdf4a6f6a214499ac3db93e0fb483a2.png",
    "ocr_text": "sacombank-sbj m4 86: bm.qdtg.02a\nban hanh: ( / /2025)\nbang gia bac\nhiéu luc ta: 16h30 bon vj tinh: vnd/lugng\nloalbac ff cumua | ciaean\nbac miéng kim-phiic-léc sbj 999 1 lung 1.935.000 1.986.000",
    "crawled_at": "2025-11-22T16:16:06.681084Z"
  },
  {
    "url": "https://sacombank-sbj.com/blogs/bang-gia-bac/bang-ty-gia-bac-ngay-20-11-2025-bang-6",
    "title": "Bảng Tỷ Giá Bạc - Ngày 20/11/2025 - Bảng 6",
    "date": "2025-11-20",
    "silver_type": "Bạc Miếng Kim-Phúc-Lộc SBJ 999 1 lượng",
    "buy": 1938000,
    "sell": 1989000,
    "effective_time": "15:20",
    "image_url": "https://cdn.hstatic.net/200000315699/file/l6_3e3e703024f54fbe951a83821b81d26c.png",
    "ocr_text": "sacombank-sbj\ncong ty vang bac ba quy\nbang gia bac\nbang: 06 ngday 20/11/2025\nhiéu luc ta: 15h20\nm 86: bm.qdtg.02a\nban hanh: ( / /2025)\ndon vj tinh: vnd/lugng\nab fcrmua [cia ban\nbac miéng kim-phic-léc sbj 999 1 ludng\n1.938.000\n1.989.000",
    "crawled_at": "2025-11-22T16:16:07.897739Z"
  },
  {
    "url": "https://sacombank-sbj.com/blogs/bang-gia-bac/bang-ty-gia-bac-ngay-20-11-2025-bang-5",
    "title": "Bảng Tỷ Giá Bạc - Ngày 20/11/2025 - Bảng 5",
    "date": "2025-11-20",
    "silver_type": "Bạc Miếng Kim-Phúc-Lộc SBJ 999 1 lượng",
    "buy": 1944000,
    "sell": 1995000,
    "effective_time": "14:10",
    "image_url": "https://cdn.hstatic.net/200000315699/file/l5_c58331d97e534419823f683d2a10aee0.png",
    "ocr_text": "sacombank-sbj mé 86: bm.qdtg.02a\ncong ty vang bac ba guy\nban hanh:( / /2025)\ns6:.\nbang gia bac\nhiéu luc ta: 14h10 bon vj tinh: vnb/luong\n(oat bac fcrmua [cia ban\nbac miéng kim-phic-léc sbj 999 1 ludng 1.944.000 1.995.000",
    "crawled_at": "2025-11-22T16:16:09.090562Z"
  },
  {
    "url": "https://sacombank-sbj.com/blogs/bang-gia-bac/bang-ty-gia-bac-ngay-20-11-2025-bang-4",
    "title": "Bảng Tỷ Giá Bạc - Ngày 20/11/2025 - Bảng 4",
    "date": "2025-11-20",
    "silver_type": "Bạc Miếng Kim-Phúc-Lộc SBJ 999 1 lượng",
    "buy": 1953000,
    "sell": 2004000,
    "effective_time": "10:50",
    "image_url": "https://cdn.hstatic.net/200000315699/file/l4_8e775731d1b1447d87c4ee5e1ab5080f.png",
    "ocr_text": "sacombank-sbj\ncong ty vang bac ba quy\nbang gia bac\nbang: 04 ngday 20/11/2025\nhiéu luc ta: 10h50\nm 86: bm.qdtg.02a\nban hanh: ( / /2025)\ndon vj tinh: vnd/lugng\n(oat bac fcrmua [cia ban\nbac miéng kim-phic-léc sbj 999 1 ludng\n1.953.000\n2.004.000",
    "crawled_at": "2025-11-22T16:16:10.366865Z"
  },
  {
    "url": "https://sacombank-sbj.com/blogs/bang-gia-bac/bang-ty-gia-bac-ngay-20-11-2025-bang-3",
    "title": "Bảng Tỷ Giá Bạc - Ngày 20/11/2025 - Bảng 3",
    "date": "2025-11-20",
    "silver_type": "Bạc Miếng Kim-Phúc-Lộc SBJ 999 1 lượng",
    "buy": 1938000,
    "sell": 1989000,
    "effective_time": "09:32",
    "image_url": "https://cdn.hstatic.net/200000315699/file/l3_fca6837120a24f2c96967bc040c5f47e.png",
    "ocr_text": "sacombank-sbj m& 86: bm.qdtg.02a\ncong ty vang bac ba quy\nban hanh: ( / /2025)\ns6:.\nbang gia bac\nhiéu luce fir: 09h32 don vi tinh: vnd/luong\nloa bag cima [cia pan\nbac miéng kim-phie-léc sbj 999 1 ludng 1.938.000 1.989.000",
    "crawled_at": "2025-11-22T16:16:11.669809Z"
  },
  {
    "url": "https://sacombank-sbj.com/blogs/bang-gia-bac/bang-ty-gia-bac-ngay-20-11-2025-bang-2",
    "title": "Bảng Tỷ Giá Bạc - Ngày 20/11/2025 - Bảng 2",
    "date": "2025-11-20",
    "silver_type": "Bạc Miếng Kim-Phúc-Lộc SBJ 999 1 lượng",
    "buy": 1956000,
    "sell": 2007000,
    "effective_time": "09:10",
    "image_url": "https://cdn.hstatic.net/200000315699/file/l2_4b88ced050a744d5a10fddb6057bf502.png",
    "ocr_text": "sacombank-sbj ma s6: bm.qdtg.02a\ncong ty vang bac ba uy\nban hanh: ( / /2025)\nbang gia bac\nhiéu luc ta: 09h10 bon vj tinh: vnb/luong\n(oat bac fcrmua [cia ban\nbac miéng kim-phic-léc sbj 999 1 ludng 1.956.000 2.007.000",
    "crawled_at": "2025-11-22T16:16:12.885841Z"
  },
  {
    "url": "https://sacombank-sbj.com/blogs/bang-gia-bac/bang-ty-gia-bac-ngay-20-11-2025-bang-1",
    "title": "Bảng Tỷ Giá Bạc - Ngày 20/11/2025 - Bảng 1",
    "date": "2025-11-20",
    "silver_type": "Bạc Miếng Kim-Phúc-Lộc SBJ 999 iuo‘ng",
    "buy": 1968000,
    "sell": 2019000,
    "effective_time": "07:30",
    "image_url": "https://cdn.hstatic.net/200000315699/file/hinh_anh_20-11-25_luc_07.21_89ee45310fc44e4b8c88574dc2c9ee40.jpeg",
    "ocr_text": "sacombank-sbj m& s6: bm.qdtg.02a\nsaan ao ale repttatet lee)\nbang gia bac\nhiéu lure tir: 07h30 don vj tinh: vnd/uorng\nloalbac [ciawua_giaban\nbac miéng kim-phtic-léc sbu 999 1 iuo‘ng 1.968.000 2.019.000",
    "crawled_at": "2025-11-22T16:16:14.715592Z"
  },
  {
    "url": "https://sacombank-sbj.com/blogs/bang-gia-bac/bang-ty-gia-bac-ngay-19-11-2025-bang-9",
    "title": "Bảng Tỷ Giá Bạc - Ngày 19/11/2025 - Bảng 9",
    "date": "2025-11-19",
    "silver_type": "Bạc Miếng Kim-Phúc-Lộc SBJ 999 1 lượng",
    "buy": 1983000,
    "sell": 2034000,
    "effective_time": "17:40",
    "image_url": "https://cdn.hstatic.net/200000315699/file/l9_93ac5db344e64939a7fcd14c5801a9da.png",
    "ocr_text": "sacombank-sbj\ncong ty vang bac ba quy\nbang gia bac\nbang: 09 ngay 19/11/2025\nhiéu luc ta: 17h40\nm 86: bm.qdtg.02a\nban hanh: ( / /2025)\ndon vj tinh: vnd/lugng\nab fcrmua [cia ban\nbac miéng kim-phic-léc sbj 999 1 ludng\n1.983.000\n2.034.000",
    "crawled_at": "2025-11-22T16:16:15.900568Z"
  },
  {
    "url": "https://sacombank-sbj.com/blogs/bang-gia-bac/bang-ty-gia-bac-ngay-19-11-2025-bang-8",
    "title": "Bảng Tỷ Giá Bạc - Ngày 19/11/2025 - Bảng 8",
    "date": "2025-11-19",
    "silver_type": "Bạc Miếng Kim-Phúc-Lộc SBJ 999 1 lượng",
    "buy": 1968000,
    "sell": 2019000,
    "effective_time": "17:25",
    "image_url": "https://cdn.hstatic.net/200000315699/file/l8._e6bcdcb5d85d4bd4b96af99a25971cd3.png",
    "ocr_text": "sacombank-sbj mas: bm.qdtg.02a\ncong ty vang bac da quy\nban hanh: ( / /2025)\nbang gia bac\nhiéu luce tir: 17h25 don vi tinh: vnd/luong\nloa bag cima [cia pan\nbac miéng kim-phie-léc sbj 999 1 ludng 1.968.000 2.019.000",
    "crawled_at": "2025-11-22T16:16:17.260189Z"
  },
  {
    "url": "https://sacombank-sbj.com/blogs/bang-gia-bac/bang-ty-gia-bac-ngay-19-11-2025-bang-7",
    "title": "Bảng Tỷ Giá Bạc - Ngày 19/11/2025 - Bảng 7",
    "date": "2025-11-19",
    "silver_type": "Bạc Miếng Kim-Phúc-Lộc SBJ 999 1 lượng",
    "buy": 1956000,
    "sell": 2007000,
    "effective_time": "16:50",
    "image_url": "https://cdn.hstatic.net/200000315699/file/l7_49166ba30e1042b8a58dece0cc2ffaf5.png",
    "ocr_text": "sacombank-sbj mas: bm.qdtg.02a\ncong ty vang bac da quy\nban hanh: ( / /2025)\n‘s odaeseness\nbang gia bac\nhiéu luce tir: 16h50 don vi tinh: vnd/luong\nloa bag cima [cia pan\nbac miéng kim-phie-léc sbj 999 1 ludng 1.956.000 2.007.000",
    "crawled_at": "2025-11-22T16:16:18.763571Z"
  },
  {
    "url": "https://sacombank-sbj.com/blogs/bang-gia-bac/bang-ty-gia-bac-ngay-19-11-2025-bang-6",
    "title": "Bảng Tỷ Giá Bạc - Ngày 19/11/2025 - Bảng 6",
    "date": "2025-11-19",
    "silver_type": "Bạc Miếng Kim-Phúc-Lộc SBJ 999 1 lượng",
    "buy": 1953000,
    "sell": 2004000,
    "effective_time": "14:22",
    "image_url": "https://cdn.hstatic.net/200000315699/file/l6_4bc89032b5f8470292b9ce578e04a243.png",
    "ocr_text": "sacombank-sbj\ncong ty vang bac ba quy\nbang gia bac\nbang: 06 ngay 19/11/2025\nhiéu luc ta 14h22\nm 86: bm.qdtg.02a\nban hanh: ( / /2025)\ndon vj tinh: vnd/lugng\n(oat bac fcrmua [cia ban\nbac miéng kim-phic-léc sbj 999 1 ludng\n1.953.000\n2.004.000",
    "crawled_at": "2025-11-22T16:16:19.992125Z"
  },
  {
    "url": "https://sacombank-sbj.com/blogs/bang-gia-bac/bang-ty-gia-bac-ngay-19-11-2025-bang-5",
    "title": "Bảng Tỷ Giá Bạc - Ngày 19/11/2025 - Bảng 5",
    "date": "2025-11-19",
    "silver_type": "Bạc Miếng Kim-Phúc-Lộc SBJ 999 1 lượng",
    "buy": 1950000,
    "sell": 2001000,
    "effective_time": "13:15",
    "image_url": "https://cdn.hstatic.net/200000315699/file/l5_bff8957ae0da4d9c8c1e4e181cc5648e.png",
    "ocr_text": "sacombank-sbj mas: bm.qdtg.02a\ncong ty vang bac da quy\nban hanh: ( / /2025)\nbang gia bac\nhiéu lue ti: 13h15 don vi tinh: vnd/luong\nloa bag cima [cia pan\nbac miéng kim-phie-léc sbj 999 1 ludng 1.950.000 2.001.000",
    "crawled_at": "2025-11-22T16:16:21.454889Z"
  },
  {
    "url": "https://sacombank-sbj.com/blogs/bang-gia-bac/bang-ty-gia-bac-ngay-19-11-2025-bang-4",
    "title": "Bảng Tỷ Giá Bạc - Ngày 19/11/2025 - Bảng 4",
    "date": "2025-11-19",
    "silver_type": "Bạc Miếng Kim-Phúc-Lộc SBJ 999 1 lượng",
    "buy": 1935000,
    "sell": 1986000,
    "effective_time": "11:35",
    "image_url": "https://cdn.hstatic.net/200000315699/file/l4_beceb88cf4974add8bdce7398b77420f.png",
    "ocr_text": "sacombank-sbj ma s6: bm.qdtg.02a\ncong ty vang bac da quy\nban hanh: ( / /2025)\n‘s odaeseness\nbang gia bac\nhiéu tue tir: 11h35 don vi tinh: vnd/luong\nloa bag cima [cia pan\nbac miéng kim-phie-léc sbj 999 1 ludng 1.935.000 1.986.000",
    "crawled_at": "2025-11-22T16:16:22.810530Z"
  },
  {
    "url": "https://sacombank-sbj.com/blogs/bang-gia-bac/bang-ty-gia-bac-ngay-19-11-2025-bang-3",
    "title": "Bảng Tỷ Giá Bạc - Ngày 19/11/2025 - Bảng 3",
    "date": "2025-11-19",
    "silver_type": "Bạc Miếng Kim-Phúc-Lộc SBJ 999 1 lượng",
    "buy": 1941000,
    "sell": 1992000,
    "effective_time": "10:08",
    "image_url": "https://cdn.hstatic.net/200000315699/file/l3_014b8a5401b24bfcabcf3bd835c1518d.png",
    "ocr_text": "sacombank-sbj mas: bm.qdtg.02a\ncong ty vang bac da quy\nban hanh: ( / /2025)\nbang gia bac\nhiéu luce fir: 10h08 don vi tinh: vnd/luong\nloa bag cima [cia pan\nbac miéng kim-phie-léc sbj 999 1 ludng 1.941.000 1.992.000",
    "crawled_at": "2025-11-22T16:16:24.051400Z"
  },
  {
    "url": "https://sacombank-sbj.com/blogs/bang-gia-bac/bang-ty-gia-bac-ngay-19-11-2025-bang-2",
    "title": "Bảng Tỷ Giá Bạc - Ngày 19/11/2025 - Bảng 2",
    "date": "2025-11-19",
    "silver_type": "Bạc Miếng Kim-Phúc-Lộc SBJ 999 1 lượng",
    "buy": 1929000,
    "sell": 1980000,
    "effective_time": "08:28",
    "image_url": "https://cdn.hstatic.net/200000315699/file/l2_0583c14801eb4bf182193aba9f35bff2.png",
    "ocr_text": "sacombank-sbj m& 86: bm.qdtg.02a\ncong ty vang bac ba quy\nban hanh: ( / /2025)\ns6.\nbang gia bac\nhiéu luce fir: 08h28 don vi tinh: vnd/luong\nloa bag cima [cia pan\nbac miéng kim-phie-léc sbj 999 1 ludng 1.929.000 1.980.000",
    "crawled_at": "2025-11-22T16:16:30.935492Z"
  },
  {
    "url": "https://sacombank-sbj.com/blogs/bang-gia-bac/bang-ty-gia-bac-ngay-19-11-2025-bang-1",
    "title": "Bảng Tỷ Giá Bạc - Ngày 19/11/2025 - Bảng 1",
    "date": "2025-11-19",
    "silver_type": "Bạc Miếng Kim-Phúc-Lộc SBJ 999 iuo‘ng",
    "buy": 1917000,
    "sell": 1968000,
    "effective_time": "07:30",
    "image_url": "https://cdn.hstatic.net/200000315699/file/hinh_anh_19-11-25_luc_07.23_64c7fe4f720748f6a184851f023469fe.jpeg",
    "ocr_text": "sacombank-sbj m& s6: bm.qdtg.02a\na ca oa ban hanh:( / /2025)\n> zz\nbang gia bac\nbang: 01 ngay 19/11/2025\nhiéu luc tie: 07h30 don vj tinh: vnd/luong\nloa bac [ciamua_giaban\nbac miéng kim-phtic-léc sbu 999 1 iuo‘ng 1.917.000 1.968.000",
    "crawled_at": "2025-11-22T16:16:32.093403Z"
  },
  {
    "url": "https://sacombank-sbj.com/blogs/bang-gia-bac/bang-ty-gia-bac-ngay-18-11-2025-bang-9",
    "title": "Bảng Tỷ Giá Bạc - Ngày 18/11/2025 - Bảng 9",
    "date": "2025-11-18",
    "silver_type": "Bạc Miếng Kim-Phúc-Lộc SBJ 999 1 lượng",
    "buy": 1914000,
    "sell": 1965000,
    "effective_time": "16:40",
    "image_url": "https://cdn.hstatic.net/200000315699/file/l9_8615ebd6251449b888f00956e9ffdc2c.png",
    "ocr_text": "sacombank-sbj mas: bm.qdtg.02a\ncong ty vang bac da quy\nban hanh: ( / /2025)\n‘s odaeseness\nbang gia bac\nhiéu luce fir: 16h40 don vi tinh: vnd/luong\nloa bag cima [cia pan\nbac miéng kim-phie-léc sbj 999 1 ludng 1.914.000 1.965.000",
    "crawled_at": "2025-11-22T16:16:33.652665Z"
  },
  {
    "url": "https://sacombank-sbj.com/blogs/bang-gia-bac/bang-ty-gia-bac-ngay-18-11-2025-bang-8",
    "title": "Bảng Tỷ Giá Bạc - Ngày 18/11/2025 - Bảng 8",
    "date": "2025-11-18",
    "silver_type": "Bạc Miếng Kim-Phúc-Lộc SBJ 999 1 lượng",
    "buy": 1911000,
    "sell": 1962000,
    "effective_time": "15:50",
    "image_url": "https://cdn.hstatic.net/200000315699/file/l8_f2a6e7a0d27e4b4d9430986d72287734.png",
    "ocr_text": "sacombank-sbj ma s6: bm.qdtg.02a\ncong ty vang bac da quy\nban hanh: ( / /2025)\n‘s odaeseness\nbang gia bac\nhiéu luce fir: 15h50 don vi tinh: vnd/luong\nloa bag cima [cia pan\nbac miéng kim-phie-léc sbj 999 1 ludng 1.911.000 1.962.000",
    "crawled_at": "2025-11-22T16:16:35.353919Z"
  },
  {
    "url": "https://sacombank-sbj.com/blogs/bang-gia-bac/bang-ty-gia-bac-ngay-18-11-2025-bang-7",
    "title": "Bảng Tỷ Giá Bạc - Ngày 18/11/2025 - Bảng 7",
    "date": "2025-11-18",
    "silver_type": "Bạc Miếng Kim-Phúc-Lộc SBJ 999 1 lượng",
    "buy": 1902000,
    "sell": 1953000,
    "effective_time": "15:22",
    "image_url": "https://cdn.hstatic.net/200000315699/file/l7_ef593de1f2514c35a9826b1e5f8b9786.png",
    "ocr_text": "sacombank-sbj\ncong ty vang bac ba quy\nbang gia bac\nbang: 07 ngay 18/11/2025\nhiéu luc ta: 15h22\nm 86: bm.qdtg.02a\nban hanh: ( / /2025)\ndon vj tinh: vnd/lugng\n(oat bac fcrmua [cia ban\nbac miéng kim-phic-léc sbj 999 1 ludng\n1.902.000\n1.953.000",
    "crawled_at": "2025-11-22T16:16:36.818371Z"
  },
  {
    "url": "https://sacombank-sbj.com/blogs/bang-gia-bac/bang-ty-gia-bac-ngay-18-11-2025-bang-6",
    "title": "Bảng Tỷ Giá Bạc - Ngày 18/11/2025 - Bảng 6",
    "date": "2025-11-18",
    "silver_type": "Bạc Miếng Kim-Phúc-Lộc SBJ 999 1 lượng",
    "buy": 1896000,
    "sell": 1947000,
    "effective_time": "14:05",
    "image_url": "https://cdn.hstatic.net/200000315699/file/l6_6ba6e027088449e9be5a9c327b8d732a.png",
    "ocr_text": "sacombank-sbj\ncong ty vang bac ba quy\ns6:.\nbang gia bac\nbang: 06 ngay 18/11/2025\nhiéu luc ta: 14h05\nm 86: bm.qdtg.02a\nban hanh: ( / /2025)\ndon vj tinh: vnd/lugng\n(oat bac fcrmua [cia ban\nbac miéng kim-phic-léc sbj 999 1 ludng\n1.896.000\n1.947.000",
    "crawled_at": "2025-11-22T16:16:38.040525Z"
  },
  {
    "url": "https://sacombank-sbj.com/blogs/bang-gia-bac/bang-ty-gia-bac-ngay-18-11-2025-bang-5",
    "title": "Bảng Tỷ Giá Bạc - Ngày 18/11/2025 - Bảng 5",
    "date": "2025-11-18",
    "silver_type": "Bạc Miếng Kim-Phúc-Lộc SBJ 999 1 lượng",
    "buy": 1902000,
    "sell": 1953000,
    "effective_time": "13:15",
    "image_url": "https://cdn.hstatic.net/200000315699/file/l5_69c2c47f010047b08f366f18843a49e1.png",
    "ocr_text": "sacombank-sbj\nbang gia bac\nbang: 05 ngay 18/11/2025\nhiéu luc ti: 13h15\nloalbac ff ckmua | onan\nmé s6:bm.qdtg.02a\nban hanh:( / /2025)\nbon vj tinh: vnb/luong\nbac miéng kim-phtic-léc sbj 999 1 ludng\n1.902.000\n1.953.000",
    "crawled_at": "2025-11-22T16:16:39.296762Z"
  },
  {
    "url": "https://sacombank-sbj.com/blogs/bang-gia-bac/bang-ty-gia-bac-ngay-18-11-2025-bang-4",
    "title": "Bảng Tỷ Giá Bạc - Ngày 18/11/2025 - Bảng 4",
    "date": "2025-11-18",
    "silver_type": "Bạc Miếng Kim-Phúc-Lộc SBJ 999 1 lượng",
    "buy": 1905000,
    "sell": 1956000,
    "effective_time": "10:15",
    "image_url": "https://cdn.hstatic.net/200000315699/file/l4_18fcfe0dab454010b4dc0bedad4d4c8c.png",
    "ocr_text": "sacombank-sbj mé 86: bm.qdtg.02a\nban hanh:( / /2025)\nbang gia bac\nhiéu luc ta: 10h15 bon vj tinh: vnb/luong\n(oat bac fcrmua [cia ban\nbac miéng kim-phic-léc sbj 999 1 ludng 1.905.000 1.956.000",
    "crawled_at": "2025-11-22T16:16:41.104562Z"
  },
  {
    "url": "https://sacombank-sbj.com/blogs/bang-gia-bac/bang-ty-gia-bac-ngay-18-11-2025-bang-3",
    "title": "Bảng Tỷ Giá Bạc - Ngày 18/11/2025 - Bảng 3",
    "date": "2025-11-18",
    "silver_type": "Bạc Miếng Kim-Phúc-Lộc SBJ 999 1 lượng",
    "buy": 1908000,
    "sell": 1959000,
    "effective_time": "09:22",
    "image_url": "https://cdn.hstatic.net/200000315699/file/l3_758ce4cd905d47b182f093b2a54d31bc.png",
    "ocr_text": "sacombank-sbj mé 86: bm.qdtg.02a\nban hanh:( / /2025)\nbang gia bac\nhiéu luc ta: 09h22 bon vj tinh: vnb/luong\nbac fcrmua [cia ban\nbac miéng kim-phic-léc sbj 999 1 ludng 1.908.000 1.959.000",
    "crawled_at": "2025-11-22T16:16:42.344334Z"
  },
  {
    "url": "https://sacombank-sbj.com/blogs/bang-gia-bac/bang-ty-gia-bac-ngay-18-11-2025-bang-2",
    "title": "Bảng Tỷ Giá Bạc - Ngày 18/11/2025 - Bảng 2",
    "date": "2025-11-18",
    "silver_type": "Bạc Miếng Kim-Phúc-Lộc SBJ 999 1 lượng",
    "buy": 1914000,
    "sell": 1965000,
    "effective_time": "08:35",
    "image_url": "https://cdn.hstatic.net/200000315699/file/l2_caf082783ea0415cb5457c89bd24836e.png",
    "ocr_text": "sacombank-sbj\ncong ty vang bac ba quy\nbang gia bac\nbang: 02 ngay 18/11/2025\nhiéu luc ta: 08h35\nm 86: bm.qdtg.02a\nban hanh: ( / /2025)\ndon vj tinh: vnd/lugng\nab fcrmua [cia ban\nbac miéng kim-phic-léc sbj 999 1 ludng\n1.914.000\n1.965.000",
    "crawled_at": "2025-11-22T16:16:43.907759Z"
  },
  {
    "url": "https://sacombank-sbj.com/blogs/bang-gia-bac/bang-ty-gia-bac-ngay-18-11-2025-bang-1",
    "title": "Bảng Tỷ Giá Bạc - Ngày 18/11/2025 - Bảng 1",
    "date": "2025-11-18",
    "silver_type": "Bạc Miếng Kim-Phúc-Lộc SBJ 999 lu’o‘ng",
    "buy": 1923000,
    "sell": 1974000,
    "effective_time": "07:30",
    "image_url": "https://cdn.hstatic.net/200000315699/file/hinh_anh_18-11-25_luc_07.26_24131227cd5f4933a77b5e9dcab0bbbb.jpeg",
    "ocr_text": "sacombank-sbj ms: bm.qdtg.02a\n. i ban hanh: ( / /2025)\n> zz\nbang gia bac\nbang: 01 ngay 18/11/2025\nhiéu lye tie: 07h30 don vj tinh: vnd/lurong\nloa bac [ciauua j giaban\nbac miéng kim-phtic-léc sbj 999 1 lu’o‘ng 1.923.000 1.974.000",
    "crawled_at": "2025-11-22T16:16:45.155659Z"
  },
  {
    "url": "https://sacombank-sbj.com/blogs/bang-gia-bac/bang-ty-gia-bac-ngay-17-11-2025-bang-7",
    "title": "Bảng Tỷ Giá Bạc - Ngày 17/11/2025 - Bảng 7",
    "date": "2025-11-17",
    "silver_type": "Bạc Miếng Kim-Phúc-Lộc SBJ 999 1 lượng",
    "buy": 1938000,
    "sell": 1989000,
    "effective_time": "16:20",
    "image_url": "https://cdn.hstatic.net/200000315699/file/l7_a8b95eecfcec4e53bd6847e5e0b0d18b.png",
    "ocr_text": "sacombank-sbj\nbang gia bac\nbang: 07 ngdy 17/11/2025\nhiéu lue ti: 16h20\nmi s6: bm.qdtg.02a\nban hanh: ( / /2025)\nbon vi tinh: vnd/luong\nloalbac ff cumua | ciaean\nbac miéng kim-phic-léc sbj 999 1 lugng\n1.938.000\n1.989.000",
    "crawled_at": "2025-11-22T16:16:46.650379Z"
  },
  {
    "url": "https://sacombank-sbj.com/blogs/bang-gia-bac/bang-ty-gia-bac-ngay-17-11-2025-bang-6",
    "title": "Bảng Tỷ Giá Bạc - Ngày 17/11/2025 - Bảng 6",
    "date": "2025-11-17",
    "silver_type": "Bạc Miếng Kim-Phúc-Lộc SBJ 999 1 lượng",
    "buy": 1935000,
    "sell": 1986000,
    "effective_time": "14:22",
    "image_url": "https://cdn.hstatic.net/200000315699/file/l6_afe9a6520d4f4e39a9a43da708376d48.png",
    "ocr_text": "sacombank-sbj\ncong ty vang bac ba quy\nbang gia bac\nbang: 06 ngay 17/11/2025\nhiéu luc ta 14h22\nm 86: bm.qdtg.02a\nban hanh: ( / /2025)\ndon vj tinh: vnd/lugng\n(oat bac fcrmua [cia ban\nbac miéng kim-phic-léc sbj 999 1 ludng\n1.935.000\n1.986.000",
    "crawled_at": "2025-11-22T16:16:57.972719Z"
  },
  {
    "url": "https://sacombank-sbj.com/blogs/bang-gia-bac/bang-ty-gia-bac-ngay-17-11-2025-bang-5",
    "title": "Bảng Tỷ Giá Bạc - Ngày 17/11/2025 - Bảng 5",
    "date": "2025-11-17",
    "silver_type": "Bạc Miếng Kim-Phúc-Lộc SBJ 999 1 lượng",
    "buy": 1932000,
    "sell": 1983000,
    "effective_time": "13:25",
    "image_url": "https://cdn.hstatic.net/200000315699/file/l5_82e05886d07a46f582f6e30cf6ab3d7a.png",
    "ocr_text": "sacombank-sbj\ncong ty vang bac ba quy\ns6:.\nbang gia bac\nbang: 05 ngdy 17/11/2025\nhiéu luc ta: 13h25\nma s6: bm.qdtg.02a\nban hanh: ( / /2025)\nbon vj tinh: vnd/luong\nloa bag cima [cia pan\nbac miéng kim-phiic-l6c sbj 999 1 ludng\n1.932.000\n1.983.000",
    "crawled_at": "2025-11-22T16:16:59.179550Z"
  },
  {
    "url": "https://sacombank-sbj.com/blogs/bang-gia-bac/bang-ty-gia-bac-ngay-17-11-2025-bang-4",
    "title": "Bảng Tỷ Giá Bạc - Ngày 17/11/2025 - Bảng 4",
    "date": "2025-11-17",
    "silver_type": "Bạc Miếng Kim-Phúc-Lộc SBJ 999 1 lượng",
    "buy": 1938000,
    "sell": 1989000,
    "effective_time": "10:52",
    "image_url": "https://cdn.hstatic.net/200000315699/file/l4_5876610b0f3d4c2d90776a914fd3db6b.png",
    "ocr_text": "sacombank-sbj mas: bm.qdtg.02a\ncong ty vang bac da quy\nban hanh: ( / /2025)\n‘s odaeseness\nbang gia bac\nhiéu luce fir: 10h52 don vi tinh: vnd/luong\nloa bag cima [cia pan\nbac miéng kim-phie-léc sbj 999 1 ludng 1.938.000 1.989.000",
    "crawled_at": "2025-11-22T16:17:00.388119Z"
  },
  {
    "url": "https://sacombank-sbj.com/blogs/bang-gia-bac/bang-ty-gia-bac-ngay-17-11-2025-bang-3",
    "title": "Bảng Tỷ Giá Bạc - Ngày 17/11/2025 - Bảng 3",
    "date": "2025-11-17",
    "silver_type": "Bạc Miếng Kim-Phúc-Lộc SBJ 999 1 lượng",
    "buy": 1944000,
    "sell": 1995000,
    "effective_time": "08:58",
    "image_url": "https://cdn.hstatic.net/200000315699/file/l3_7ea77ab398d2406f90c9f2c52eb1b559.png",
    "ocr_text": "sacombank-sbj mas: bm.qdtg.02a\ncong ty vang bac da quy\nban hanh: ( / /2025)\n‘s odaeseness\nbang gia bac\nhiéu luce tir: 08h58 don vi tinh: vnd/luong\nloa bag cima [cia pan\nbac miéng kim-phie-léc sbj 999 1 ludng 1.944.000 1.995.000",
    "crawled_at": "2025-11-22T16:17:01.628166Z"
  },
  {
    "url": "https://sacombank-sbj.com/blogs/bang-gia-bac/bang-ty-gia-bac-ngay-17-11-2025-bang-2",
    "title": "Bảng Tỷ Giá Bạc - Ngày 17/11/2025 - Bảng 2",
    "date": "2025-11-17",
    "silver_type": "Bạc Miếng Kim-Phúc-Lộc SBJ 999 1 lượng",
    "buy": 1938000,
    "sell": 1989000,
    "effective_time": "08:32",
    "image_url": "https://cdn.hstatic.net/200000315699/file/l2_f3722abf83cb4647bdddc0b21cb7b1d9.png",
    "ocr_text": "sacombank-sbj mé 86: bm.qdtg.02a\nban hanh:( / /2025)\nbang gia bac\nhiéu luc ta: 08h32 bon vj tinh: vnb/luong\n(oat bac fcrmua [cia ban\nbac miéng kim-phic-léc sbj 999 1 ludng 1.938.000 1.989.000",
    "crawled_at": "2025-11-22T16:17:02.771431Z"
  },
  {
    "url": "https://sacombank-sbj.com/blogs/bang-gia-bac/bang-ty-gia-bac-ngay-17-11-2025-bang-1",
    "title": "Bảng Tỷ Giá Bạc - Ngày 17/11/2025 - Bảng 1",
    "date": "2025-11-17",
    "silver_type": "Bạc Miếng Kim-Phúc-Lộc SBJ 999 luro‘ng",
    "buy": 1917000,
    "sell": 1968000,
    "effective_time": "07:30",
    "image_url": "https://cdn.hstatic.net/200000315699/file/hinh_anh_17-11-25_luc_07.23_d26b0de303ec4850868172a5f7511022.jpeg",
    "ocr_text": "sacombank-sbj m& s6: bm.qdtg.02a\nsaga da a ban hanh: ( / /2025)\nbang gia bac\nbang: 01 ngay 17/11/2025\nhiéu luc tir: 07h30\nloalbac [ciawua j giaban\nbac miéng kim-phtic-léc sbu 999 1 luro‘ng 1.917.000 1.968.000\ndon vj tinh: vnd/luo‘ng",
    "crawled_at": "2025-11-22T16:17:04.365007Z"
  },
  {
    "url": "https://sacombank-sbj.com/blogs/bang-gia-bac/bang-ty-gia-bac-ngay-14-11-2025-bang-6",
    "title": "Bảng Tỷ Giá Bạc - Ngày 14/11/2025 - Bảng 6",
    "date": "2025-11-14",
    "silver_type": "Bạc Miếng Kim-Phúc-Lộc SBJ 999 1 lượng",
    "buy": 1995000,
    "sell": 2046000,
    "effective_time": "16:05",
    "image_url": "https://cdn.hstatic.net/200000315699/file/l6_3a5bb04ebd3e4c3ebb76567f2ab91745.png",
    "ocr_text": "sacombank-sbj m4 86: bm.qdtg.02a\nban hanh: ( / /2025)\ns6::\nbang gia bac\nhiéu luc ta: 16h05 bon vj tinh: vnd/lugng\nloalbac ff cumua | ciaean\nbac miéng kim-phiic-léc sbj 999 1 lung 1.995.000 2.046.000",
    "crawled_at": "2025-11-22T16:17:05.603200Z"
  },
  {
    "url": "https://sacombank-sbj.com/blogs/bang-gia-bac/bang-ty-gia-bac-ngay-14-11-2025-bang-5",
    "title": "Bảng Tỷ Giá Bạc - Ngày 14/11/2025 - Bảng 5",
    "date": "2025-11-14",
    "silver_type": "Bạc Miếng Kim-Phúc-Lộc SBJ 999 1 lượng",
    "buy": 1983000,
    "sell": 2034000,
    "effective_time": "14:48",
    "image_url": "https://cdn.hstatic.net/200000315699/file/l5_4ded2afdb7004efeb931020697512c44.png",
    "ocr_text": "sacombank-sbj ma sé: bm.qdtg.02a\ns6:..\nbang gia bac\nbang: 05 ngay 14/11/2025\nhiéu luce ta: 14h48 bon vi tinh: vnb/luong\nloalbac ff ckmua | onan\nbac miéng kim-phuc-léc sbj 999 1 lugng 1.983.000 2.034.000",
    "crawled_at": "2025-11-22T16:17:07.123188Z"
  },
  {
    "url": "https://sacombank-sbj.com/blogs/bang-gia-bac/bang-ty-gia-bac-ngay-14-11-2025-bang-4",
    "title": "Bảng Tỷ Giá Bạc - Ngày 14/11/2025 - Bảng 4",
    "date": "2025-11-14",
    "silver_type": "Bạc Miếng Kim-Phúc-Lộc SBJ 999 1 lượng",
    "buy": 1995000,
    "sell": 2046000,
    "effective_time": "14:10",
    "image_url": "https://cdn.hstatic.net/200000315699/file/l4_b607655ae1544d6080971c07f3855986.png",
    "ocr_text": "sacombank-sbj mas: bm.qdtg.02a\ncong ty vang bac da quy\nban hanh: ( / /2025)\n‘s odaeseness\nbang gia bac\nhiéu lue tir: 14h10 don vi tinh: vnd/luong\nloa bag cima [cia pan\nbac miéng kim-phie-léc sbj 999 1 ludng 1.995.000 2.046.000",
    "crawled_at": "2025-11-22T16:17:08.366411Z"
  },
  {
    "url": "https://sacombank-sbj.com/blogs/bang-gia-bac/bang-ty-gia-bac-ngay-14-11-2025-bang-3",
    "title": "Bảng Tỷ Giá Bạc - Ngày 14/11/2025 - Bảng 3",
    "date": "2025-11-14",
    "silver_type": "Bạc Miếng Kim-Phúc-Lộc SBJ 999 1 lượng",
    "buy": 2004000,
    "sell": 2055000,
    "effective_time": "13:15",
    "image_url": "https://cdn.hstatic.net/200000315699/file/l3_6e378aee30c8404eaa803b764de62411.png",
    "ocr_text": "sacombank-sbj mas6: bm.qdtg.02a\nban hanh: ( / /2025)\nbang gia bac\nhiéu luce tit: 13h15 don vj tinh: vnd/luong\n(oal bac ff cmua | clasan\nbac miéng kim-phuc-léc sbj 999 1 luong 2.004.000 2.055.000",
    "crawled_at": "2025-11-22T16:17:09.573638Z"
  },
  {
    "url": "https://sacombank-sbj.com/blogs/bang-gia-bac/bang-ty-gia-bac-ngay-14-11-2025-bang-2",
    "title": "Bảng Tỷ Giá Bạc - Ngày 14/11/2025 - Bảng 2",
    "date": "2025-11-14",
    "silver_type": "Bạc Miếng Kim-Phúc-Lộc SBJ 999 1 lượng",
    "buy": 2010000,
    "sell": 2061000,
    "effective_time": "10:15",
    "image_url": "https://cdn.hstatic.net/200000315699/file/l2_bb72f07971b0439ab77d4beacfe494e4.png",
    "ocr_text": "sacombank-sbj\ncong ty vang bac ba quy\nbang gia bac\nbang: 02 ngay 14/11/2025\nhiéu luc ta: 10h15\nm 86: bm.qdtg.02a\nban hanh: ( / /2025)\ndon vj tinh: vnd/lugng\n(oat bac fcrmua [cia ban\nbac miéng kim-phic-léc sbj 999 1 ludng\n2.010.000\n2.061.000",
    "crawled_at": "2025-11-22T16:17:12.676704Z"
  },
  {
    "url": "https://sacombank-sbj.com/blogs/bang-gia-bac/bang-ty-gia-bac-ngay-14-11-2025-bang-1",
    "title": "Bảng Tỷ Giá Bạc - Ngày 14/11/2025 - Bảng 1",
    "date": "2025-11-14",
    "silver_type": "Bạc Miếng Kim-Phúc-Lộc SBJ 999 iu'o‘ng",
    "buy": 2001000,
    "sell": 2052000,
    "effective_time": "07:30",
    "image_url": "https://cdn.hstatic.net/200000315699/file/hinh_anh_14-11-25_luc_07.22_5bac785ce57d4710b761f4b1439e0d96.jpeg",
    "ocr_text": "sacombank-sbj m4 s6: bm.qdtg.02a\nsg ban hanh: ( / /2025)\n> zz\nbang gia bac\nbang: 01 ngay 14/11/2025\nhiéu luc tie: 07h30 dorn vj tinh: vnd/luong\nlol bac [ciawua j giaban\nbac miéng kim-phtic-léc sbj 999 1 iu'o‘ng 2.001.000 2.052.000",
    "crawled_at": "2025-11-22T16:17:13.953197Z"
  },
  {
    "url": "https://sacombank-sbj.com/blogs/bang-gia-bac/bang-ty-gia-bac-ngay-13-11-2025-bang-7",
    "title": "Bảng Tỷ Giá Bạc - Ngày 13/11/2025 - Bảng 7",
    "date": "2025-11-13",
    "silver_type": "Bạc Miếng Kim-Phúc-Lộc SBJ 999 1 lượng",
    "buy": 2037000,
    "sell": 2088000,
    "effective_time": "16:05",
    "image_url": "https://cdn.hstatic.net/200000315699/file/l7_d04e199590124a8180412a7e03fea654.png",
    "ocr_text": "sacombank-sbj ma s6: bm.qdtg.02a\ncong ty vang bac ba uy\nban hanh: ( / /2025)\nbang gia bac\nhiéu luc ta: 16h05 bon vj tinh: vnb/luong\n(oat bac fcrmua [cia ban\nbac miéng kim-phic-léc sbj 999 1 ludng 2.037.000 2.088.000",
    "crawled_at": "2025-11-22T16:17:15.358606Z"
  },
  {
    "url": "https://sacombank-sbj.com/blogs/bang-gia-bac/bang-ty-gia-bac-ngay-13-11-2025-bang-6",
    "title": "Bảng Tỷ Giá Bạc - Ngày 13/11/2025 - Bảng 6",
    "date": "2025-11-13",
    "silver_type": "Bạc Miếng Kim-Phúc-Lộc SBJ 999 1 lượng",
    "buy": 2034000,
    "sell": 2085000,
    "effective_time": null,
    "image_url": "https://cdn.hstatic.net/200000315699/file/a45f5522de10524e0b01__1__c746a086465944858cc50554590525b9.jpg",
    "ocr_text": "sacombank-sbj ‘mé 86: bm.qdtg.024\ncorea b98 06 2 fie sees)\nbang gia bac\nbang: 6 ngay 13/11/2025\nbon vi tinh: vnb/luong\nies | cumua | cuazan\nbac miéng kim-phiic-léc sbj 999 1 lugng 2,034,000 2,085,000",
    "crawled_at": "2025-11-22T16:17:16.370483Z"
  },
  {
    "url": "https://sacombank-sbj.com/blogs/bang-gia-bac/bang-ty-gia-bac-ngay-13-11-2025-bang-5",
    "title": "Bảng Tỷ Giá Bạc - Ngày 13/11/2025 - Bảng 5",
    "date": "2025-11-13",
    "silver_type": "Bạc Miếng Kim-Phúc-Lộc SBJ 999 1 lượng",
    "buy": 2025000,
    "sell": 2076000,
    "effective_time": "13:15",
    "image_url": "https://cdn.hstatic.net/200000315699/file/l5_f0bf08bdd9464ebf87dd813a6ea98aa0.png",
    "ocr_text": "sacombank-sbj mas: bm.qdtg.02a\ncong ty vang bac da quy\nban hanh: ( / /2025)\n‘s odaeseness\nbang gia bac\nhiéu lue ti: 13h15 don vi tinh: vnd/luong\nloa bag cima [cia pan\nbac miéng kim-phie-léc sbj 999 1 ludng 2.025.000 2.076.000",
    "crawled_at": "2025-11-22T16:17:17.685219Z"
  },
  {
    "url": "https://sacombank-sbj.com/blogs/bang-gia-bac/bang-ty-gia-bac-ngay-13-11-2025-bang-4",
    "title": "Bảng Tỷ Giá Bạc - Ngày 13/11/2025 - Bảng 4",
    "date": "2025-11-13",
    "silver_type": "Bạc Miếng Kim-Phúc-Lộc SBJ 999 1 lượng",
    "buy": 2016000,
    "sell": 2067000,
    "effective_time": "10:28",
    "image_url": "https://cdn.hstatic.net/200000315699/file/l4_9500799fe1e9492a8561e298d6b27664.png",
    "ocr_text": "sacombank-sbj m& 86: bm.qdtg.02a\ncong ty vang bac ba quy\nban hanh: ( / /2025)\ns6:.\nbang gia bac\nhiéu lue tir: 10h28 don vi tinh: vnd/luong\nloa bag cima [cia pan\nbac miéng kim-phie-léc sbj 999 1 ludng 2.016.000 2.067.000",
    "crawled_at": "2025-11-22T16:17:18.891841Z"
  },
  {
    "url": "https://sacombank-sbj.com/blogs/bang-gia-bac/bang-ty-gia-bac-ngay-13-11-2025-bang-3",
    "title": "Bảng Tỷ Giá Bạc - Ngày 13/11/2025 - Bảng 3",
    "date": "2025-11-13",
    "silver_type": "Bạc Miếng Kim-Phúc-Lộc SBJ 999 1 lượng",
    "buy": 2010000,
    "sell": 2061000,
    "effective_time": "09:25",
    "image_url": "https://cdn.hstatic.net/200000315699/file/l3_e41e952853b3439c84efdaf4f665e80c.png",
    "ocr_text": "sacombank-sbj ma s6: bm.qdtg.02a\ncong ty vang bac ba quy\nban hanh: ( / /2025)\nbang gia bac\nhiéu luc ta: 09h25 bon vj tinh: vnb/luong\n(oat bac fcrmua [cia ban\nbac miéng kim-phic-léc sbj 999 1 ludng 2.010.000 2.061.000",
    "crawled_at": "2025-11-22T16:17:20.330557Z"
  },
  {
    "url": "https://sacombank-sbj.com/blogs/bang-gia-bac/bang-ty-gia-bac-ngay-13-11-2025-bang-2",
    "title": "Bảng Tỷ Giá Bạc - Ngày 13/11/2025 - Bảng 2",
    "date": "2025-11-13",
    "silver_type": "Bạc Miếng Kim-Phúc-Lộc SBJ 999 1 lượng",
    "buy": 2007000,
    "sell": 2058000,
    "effective_time": "08:28",
    "image_url": "https://cdn.hstatic.net/200000315699/file/l2r_e65f7882d1cf4d1780f338de50147ed6.png",
    "ocr_text": "sacombank-sbj\ncong ty vang bac ba quy\nbang gia bac\nbang: 02 ngay 13/11/2025\nhiéu luce ti: 08h28\nma s6: bm.qdtg.02a\nban hanh: ( / /2025)\ndon vi tinh: vnd/luong\n(oal bac ff cmua | clasan\nbac miéng kim-phuc-léc sbj 999 1 luong\n2.007.000\n2.058.000",
    "crawled_at": "2025-11-22T16:17:21.901901Z"
  },
  {
    "url": "https://sacombank-sbj.com/blogs/bang-gia-bac/bang-ty-gia-bac-ngay-13-11-2025-bang-1",
    "title": "Bảng Tỷ Giá Bạc - Ngày 13/11/2025 - Bảng 1",
    "date": "2025-11-13",
    "silver_type": "Bạc Miếng Kim-Phúc-Lộc SBJ 999 iuorng",
    "buy": 1992000,
    "sell": 2040000,
    "effective_time": "07:30",
    "image_url": "https://cdn.hstatic.net/200000315699/file/hinh_anh_13-11-25_luc_07.20_e2b7ca74ac1b4d25a19901b7256f24c5.jpeg",
    "ocr_text": "sacombank-sbj mas: bm.qdtg.02a\n. i i ban hanh: ( / /2025)\nbang gia bac\ns6:...\nbang: 01 ngay 13/11/2025\nhiéu luc tir: 07h30\nloa bac [ciauua_giaban\nbac miéng kim-phtic-léc sbu 999 1 iuorng 1.992.000 2.040.000\ndon vj tinh: vnd/uo‘ng",
    "crawled_at": "2025-11-22T16:17:23.127204Z"
  },
  {
    "url": "https://sacombank-sbj.com/blogs/bang-gia-bac/bang-ty-gia-bac-ngay-12-11-2025-bang-7",
    "title": "Bảng Tỷ Giá Bạc - Ngày 12/11/2025 - Bảng 7",
    "date": "2025-11-12",
    "silver_type": "Bạc Miếng Kim-Phúc-Lộc SBJ 999 1 lượng",
    "buy": 1977000,
    "sell": 2025000,
    "effective_time": null,
    "image_url": "https://cdn.hstatic.net/200000315699/file/l7_16cffd5e2eba4e2ea7e9d7836cf49eb2.png",
    "ocr_text": "sacombank-sbj ma sé: bm.qdtg.02a\n{cong ty vang b86 9a uy ban hanh:( / /2025)\ns6:..\nbang gia bac\nhiéu luc ti: 1655 bon vj tinh: vnb/luong\nbac miéng kim-phuc-léc sbj 999 1 lugng 1.977.000 2.025.000",
    "crawled_at": "2025-11-22T16:17:25.264101Z"
  },
  {
    "url": "https://sacombank-sbj.com/blogs/bang-gia-bac/bang-ty-gia-bac-ngay-12-11-2025-bang-6",
    "title": "Bảng Tỷ Giá Bạc - Ngày 12/11/2025 - Bảng 6",
    "date": "2025-11-12",
    "silver_type": "Bạc Miếng Kim-Phúc-Lộc SBJ 999 1 lượng",
    "buy": 1974000,
    "sell": 2022000,
    "effective_time": "15:53",
    "image_url": "https://cdn.hstatic.net/200000315699/file/l6_133d62a4db5b4064a69ba894014e4257_master.png",
    "ocr_text": "sacombank-sbj mg s6: bm.qdtg.02a\ncong ty vang bac da quy\nban hanh: ( / /2025)\nbang gia bac\nhiéu lue fu: 15h53 bon vi tinh: vnd/luong\nlol bac  ciamua ygiaban\nbac miéng kim-phic-léc sbj 999 1 luong 1,974,000 2,022,000",
    "crawled_at": "2025-11-22T16:17:26.594542Z"
  },
  {
    "url": "https://sacombank-sbj.com/blogs/bang-gia-bac/bang-ty-gia-bac-ngay-12-11-2025-bang-5",
    "title": "Bảng Tỷ Giá Bạc - Ngày 12/11/2025 - Bảng 5",
    "date": "2025-11-12",
    "silver_type": "Bạc Miếng Kim-Phúc-Lộc SBJ 999 1 lượng",
    "buy": 1965000,
    "sell": 2013000,
    "effective_time": "14:55",
    "image_url": "https://cdn.hstatic.net/200000315699/file/l5_24acf6643ad641c8bc461be045cc3b60.png",
    "ocr_text": "sacombank-sbj mé 86: bm.qdtg.02a\nban hanh:( / /2025)\nbang gia bac\nhiéu luc ta: 14h55 bon vj tinh: vnb/luong\nbac fcrmua [cia ban\nbac miéng kim-phic-léc sbj 999 1 ludng 1.965.000 2.013.000",
    "crawled_at": "2025-11-22T16:17:28.766128Z"
  },
  {
    "url": "https://sacombank-sbj.com/blogs/bang-gia-bac/bang-ty-gia-bac-ngay-12-11-2025-bang-4",
    "title": "Bảng Tỷ Giá Bạc - Ngày 12/11/2025 - Bảng 4",
    "date": "2025-11-12",
    "silver_type": "Bạc Miếng Kim-Phúc-Lộc SBJ 999 1 lượng",
    "buy": 1953000,
    "sell": 2001000,
    "effective_time": null,
    "image_url": "https://cdn.hstatic.net/200000315699/file/5397ec2c2407a859f116_4dc2134183544c238eabd328aa79b3cb.jpg",
    "ocr_text": "sacombank-sbj\nbang gia bac\n: 04 ngay 12/11/2025\nhiéu luc tit 13455\n‘m3 36: bm.qdtg.024\nban hanh:( / /2025)\nbon vi tinh: vnb/uong\nies | camua | cusan\nbac miéng kim-phiic-léc sbj 999 1 lugng|\n1,953,000\n2,001,000",
    "crawled_at": "2025-11-22T16:17:29.772135Z"
  },
  {
    "url": "https://sacombank-sbj.com/blogs/bang-gia-bac/bang-ty-gia-bac-ngay-12-11-2025-bang-3",
    "title": "Bảng Tỷ Giá Bạc - Ngày 12/11/2025 - Bảng 3",
    "date": "2025-11-12",
    "silver_type": "Bạc Miếng Kim-Phúc-Lộc SBJ 999 1 lượng",
    "buy": 1950000,
    "sell": 1998000,
    "effective_time": "09:10",
    "image_url": "https://cdn.hstatic.net/200000315699/file/l3_f972edf016ab48f0b296ac64e2dabba1_master.png",
    "ocr_text": "sacombank-sbj ma s6: bm.qdtg.02a\ncong ty vang bac da quy\nban hanh: ( / /2025)\nbang gia bac\nhiéu luce fu: 09h10 bon vj tinh: vnd/luong\nloal bac /ciamua | giaban\nbac miéng kim-phic-l6c sbj 999 1 luong 1,950,000 1,998,000",
    "crawled_at": "2025-11-22T16:17:31.077856Z"
  },
  {
    "url": "https://sacombank-sbj.com/blogs/bang-gia-bac/bang-ty-gia-bac-ngay-12-11-2025-bang-2",
    "title": "Bảng Tỷ Giá Bạc - Ngày 12/11/2025 - Bảng 2",
    "date": "2025-11-12",
    "silver_type": "Bạc Miếng Kim-Phúc-Lộc SBJ 999 1 lượng",
    "buy": 1941000,
    "sell": 1989000,
    "effective_time": "08:18",
    "image_url": "https://cdn.hstatic.net/200000315699/file/l2_ddf07d879aba4351a80671a0ec58f7a1_master.png",
    "ocr_text": "sacombank-sbj ma s6: bm.qdtg.02a\ncong ty vang bac da quy\nban hanh: ( / /2025)\nbang gia bac\nhiéu lue fu: 08h18 bon vj tinh: vnd/luong\nloal bac /ciamua | giaban\nbac miéng kim-phic-l6c sbj 999 1 luong 1,941,000 1,989,000",
    "crawled_at": "2025-11-22T16:17:32.443902Z"
  },
  {
    "url": "https://sacombank-sbj.com/blogs/bang-gia-bac/bang-ty-gia-bac-ngay-12-11-2025-bang-1",
    "title": "Bảng Tỷ Giá Bạc - Ngày 12/11/2025 - Bảng 1",
    "date": "2025-11-12",
    "silver_type": "Bạc Miếng Kim-phuic-Lộc SBJ 999 lu’o‘ng",
    "buy": 1947000,
    "sell": 1995000,
    "effective_time": "07:30",
    "image_url": "https://cdn.hstatic.net/200000315699/file/hinh_anh_12-11-25_luc_07.27_6e834b28202e4f90a3334c530e9813bf.jpeg",
    "ocr_text": "sacombank-sbj ma sé: bm.qdtg.02a\ncong ty vang bac da quy ban hanh: ( / 12025)\nbang gia bac\nbang: 01 ngay 12/11/2025\nhiéu le tir: 07h30 don vj tinh: vnd/lurong\nloalbac [claus ciaban\nbac miéng kim-phuic-l6c sbj 999 1 lu’o‘ng | 1.947.000 1.995.000",
    "crawled_at": "2025-11-22T16:17:34.970468Z"
  },
  {
    "url": "https://sacombank-sbj.com/blogs/bang-gia-bac/bang-ty-gia-bac-ngay-11-11-2025-bang-9",
    "title": "Bảng Tỷ Giá Bạc - Ngày 11/11/2025 - Bảng 9",
    "date": "2025-11-11",
    "silver_type": "Bạc Miếng Kim-Phúc-Lộc SBJ 999 1 lượng",
    "buy": 1935000,
    "sell": 1983000,
    "effective_time": "15:00",
    "image_url": "https://cdn.hstatic.net/200000315699/file/l9_cf17252ccffb491e927fe56b5e709abe.png",
    "ocr_text": "sacombank-sbj ma s6: bm.qdtg.02a\ncong ty vang bac da quy\nban hanh: ( / /2025)\n‘s odaeseness\nbang gia bac\nhiéu luce fir: 15h00 don vi tinh: vnd/luong\nloa bag cima [cia pan\nbac miéng kim-phie-léc sbj 999 1 ludng 1.935.000 1.983.000",
    "crawled_at": "2025-11-22T16:17:36.442699Z"
  },
  {
    "url": "https://sacombank-sbj.com/blogs/bang-gia-bac/bang-ty-gia-bac-ngay-11-11-2025-bang-8",
    "title": "Bảng Tỷ Giá Bạc - Ngày 11/11/2025 - Bảng 8",
    "date": "2025-11-11",
    "silver_type": "Bạc Miếng Kim-Phúc-Lộc SBJ 999 1 lượng",
    "buy": 1932000,
    "sell": 1980000,
    "effective_time": "14:25",
    "image_url": "https://cdn.hstatic.net/200000315699/file/l8_cc9be35e7b844bd58c6eff7ebaef4e08.png",
    "ocr_text": "sacombank-sbj mas: bm.qdtg.02a\ncong ty vang bac da quy\nban hanh: ( / /2025)\n‘s odaeseness\nbang gia bac\nhiéu flue tir: 14h25 don vi tinh: vnd/luong\noaiba cima [cia pan\nbac miéng kim-phie-léc sbj 999 1 ludng 1.932.000 1.980.000",
    "crawled_at": "2025-11-22T16:17:37.814788Z"
  },
  {
    "url": "https://sacombank-sbj.com/blogs/bang-gia-bac/bang-ty-gia-bac-ngay-11-11-2025-bang-7",
    "title": "Bảng Tỷ Giá Bạc - Ngày 11/11/2025 - Bảng 7",
    "date": "2025-11-11",
    "silver_type": "Bạc Miếng Kim-Phúc-Lộc SBJ 999 1 lượng",
    "buy": 1938000,
    "sell": 1986000,
    "effective_time": "13:08",
    "image_url": "https://cdn.hstatic.net/200000315699/file/l7_68067c00de514bd7bfa4f5738c201cfb_master.png",
    "ocr_text": "sacombank-sbj ma s6: bm.qdtg.02a\ncong ty vang bac da quy\nban hanh: ( / /2025)\nbang gia bac\nhiéu lue fu: 13h08 bon vj tinh: vnd/luong\nloal bac /ciamua | giaban\nbac miéng kim-phic-l6c sbj 999 1 luong 1,938,000 1,986,000",
    "crawled_at": "2025-11-22T16:17:39.158995Z"
  },
  {
    "url": "https://sacombank-sbj.com/blogs/bang-gia-bac/bang-ty-gia-bac-ngay-11-11-2025-bang-6",
    "title": "Bảng Tỷ Giá Bạc - Ngày 11/11/2025 - Bảng 6",
    "date": "2025-11-11",
    "silver_type": "Bạc Miếng Kim-Phúc-Lộc SBJ 999 1 lượng",
    "buy": 1941000,
    "sell": 1989000,
    "effective_time": null,
    "image_url": "https://cdn.hstatic.net/200000315699/file/l6_3547d12a9c0b47c7ba7cb0aaa604075b_master.png",
    "ocr_text": "sacombank-sbj ma s6: bm.qdtg.02a\ncong ty vang bac da quy\nban hanh: ( / /2025)\nbang gia bac\nhiéu lue fu: 11h bon vj tinh: vnd/luong\nloal bac /ciamua | giaban\nbac miéng kim-phic-l6c sbj 999 1 luong 1,941,000 1,989,000",
    "crawled_at": "2025-11-22T16:17:40.478305Z"
  },
  {
    "url": "https://sacombank-sbj.com/blogs/bang-gia-bac/bang-ty-gia-bac-ngay-11-11-2025-bang-5",
    "title": "Bảng Tỷ Giá Bạc - Ngày 11/11/2025 - Bảng 5",
    "date": "2025-11-11",
    "silver_type": "Bạc Miếng Kim-Phúc-Lộc SBJ 999 1 lượng",
    "buy": 1932000,
    "sell": 1980000,
    "effective_time": "10:08",
    "image_url": "https://cdn.hstatic.net/200000315699/file/l5_a87bc9dc26c44cb8899ebdc2b13f56e9_master.png",
    "ocr_text": "sacombank-sbj mg s6: bm.qdtg.02a\ncong ty vang bac da quy\nban hanh: ( / /2025)\nbang gia bac\nhiéu lue fu: 10h08 bon vj tinh: vnd/luong\nloal bac /ciamua | giaban\nbac miéng kim-phic-l6c sbj 999 1 luong 1,932,000 1,980,000",
    "crawled_at": "2025-11-22T16:17:43.250698Z"
  },
  {
    "url": "https://sacombank-sbj.com/blogs/bang-gia-bac/bang-ty-gia-bac-ngay-11-11-2025-bang-4",
    "title": "Bảng Tỷ Giá Bạc - Ngày 11/11/2025 - Bảng 4",
    "date": "2025-11-11",
    "silver_type": "Bạc Miếng Kim-Phúc-Lộc SBJ 999 1 lượng",
    "buy": 1929000,
    "sell": 1977000,
    "effective_time": "09:15",
    "image_url": "https://cdn.hstatic.net/200000315699/file/l4_de72aa1db85c4eb680c5392bb86a604b_master.png",
    "ocr_text": "sacombank-sbj mg s6: bm.qdtg.02a\ncong ty vang bac da quy\nban hanh: ( / /2025)\nbang gia bac\nhiéu luce fu: o9h15 bon vj tinh: vnd/luong\nloal bac /ciamua | giaban\nbac miéng kim-phic-l6c sbj 999 1 luong 1,929,000 1,977,000",
    "crawled_at": "2025-11-22T16:17:44.893976Z"
  },
  {
    "url": "https://sacombank-sbj.com/blogs/bang-gia-bac/bang-ty-gia-bac-ngay-11-11-2025-bang-3",
    "title": "Bảng Tỷ Giá Bạc - Ngày 11/11/2025 - Bảng 3",
    "date": "2025-11-11",
    "silver_type": "Bạc Miếng Kim-Phúc-Lộc SBJ 999 1 lượng",
    "buy": 1935000,
    "sell": 1983000,
    "effective_time": "08:51",
    "image_url": "https://cdn.hstatic.net/200000315699/file/l3_b6bae818deec4279b9706c21ac0f08e6_master.png",
    "ocr_text": "sacombank-sbj ma s6: bm.qdtg.02a\ncong ty vang bac da quy\nban hanh: ( / /2025)\nbang gia bac\nhiéu luce fu: 08h51 bon vj tinh: vnd/luong\nloal bac /ciamua | giaban\nbac miéng kim-phic-l6c sbj 999 1 luong 1,935,000 1,983,000",
    "crawled_at": "2025-11-22T16:17:47.111444Z"
  },
  {
    "url": "https://sacombank-sbj.com/blogs/bang-gia-bac/bang-ty-gia-bac-ngay-11-11-2025-bang-2",
    "title": "Bảng Tỷ Giá Bạc - Ngày 11/11/2025 - Bảng 2",
    "date": "2025-11-11",
    "silver_type": "Bạc Miếng Kim-Phúc-Lộc SBJ 999 1 lượng ,932,000",
    "buy": 1932000,
    "sell": 1980000,
    "effective_time": "08:33",
    "image_url": "https://cdn.hstatic.net/200000315699/file/l2_e2a93cc963dc403aa7c458e32d272e89_master.png",
    "ocr_text": "sacombank-sbj ma s6: bm.qdtg.02a\ncong ty vang bac da quy\nban hanh: ( / /2025)\nbang gia bac\nhiéu lue fu: 08h33 bon vj tinh: vnd/luong\nloal bac | cimua j giaban\nbac miéng kim-phic-l6c sbj 999 1 luong 1,932,000 | 1,980,000",
    "crawled_at": "2025-11-22T16:17:48.329051Z"
  },
  {
    "url": "https://sacombank-sbj.com/blogs/bang-gia-bac/bang-ty-gia-bac-ngay-11-11-2025-bang-10",
    "title": "Bảng Tỷ Giá Bạc - Ngày 11/11/2025 - Bảng 10",
    "date": "2025-11-11",
    "silver_type": "Bạc Miếng Kim-Phúc-Lộc SBJ 999 1 lượng",
    "buy": 1938000,
    "sell": 1986000,
    "effective_time": "17:45",
    "image_url": "https://cdn.hstatic.net/200000315699/file/l10_441f2b2f97be49fa86eb724cfbcf5d8a.png",
    "ocr_text": "sacombank-sbj\ncong ty vang bac ba quy\nbang gia bac\nbang: 10 ngay 11/11/2025\nhiéu luc ta: 17h45\nm 86: bm.qdtg.02a\nban hanh: ( / /2025)\ndon vj tinh: vnd/lugng\n(oat bac fcrmua [cia ban\nbac miéng kim-phic-léc sbj 999 1 ludng\n1.938.000\n1.986.000",
    "crawled_at": "2025-11-22T16:17:49.457089Z"
  },
  {
    "url": "https://sacombank-sbj.com/blogs/bang-gia-bac/bang-ty-gia-bac-ngay-11-11-2025-bang-1",
    "title": "Bảng Tỷ Giá Bạc - Ngày 11/11/2025 - Bảng 1",
    "date": "2025-11-11",
    "silver_type": "Bạc Miếng Kim-Phúc-Lộc SBJ 999 iu’o‘ng",
    "buy": 1914000,
    "sell": 1962000,
    "effective_time": "07:30",
    "image_url": "https://cdn.hstatic.net/200000315699/file/hinh_anh_11-11-25_luc_07.21_ce98c4d55b174eccadcf82fdfe574d11.jpeg",
    "ocr_text": "sacombank-sbj mg s6: bm.qdtg.02a\nban hanh: ( / /2025)\nbang gia bac\nbang: 01 ngay 11/11/2025\nhiéu luc tie: 07h30 don vj tinh: vnd/luong\nloa bac es\nbac miéng kim-phtic-léc sbj 999 1 iu’o‘ng 1.914.000 1.962.000",
    "crawled_at": "2025-11-22T16:17:50.657889Z"
  },
  {
    "url": "https://sacombank-sbj.com/blogs/bang-gia-bac/bang-ty-gia-bac-ngay-10-11-2025-bang-9",
    "title": "Bảng Tỷ Giá Bạc - Ngày 10/11/2025 - Bảng 9",
    "date": "2025-11-10",
    "silver_type": "Bạc Miếng Kim-Phúc-Lộc SBJ 999 1 lượng",
    "buy": 1902000,
    "sell": 1950000,
    "effective_time": "16:05",
    "image_url": "https://cdn.hstatic.net/200000315699/file/l9_3ee73b4b92f94201b86db45c4ca5bdcd.png",
    "ocr_text": "sacombank-sbj\ncong ty vang bac ba quy\nbang gia bac\nbang: 09 ngay 10/11/2025\nhiéu luc ta: 16h05\nm 86: bm.qdtg.02a\nban hanh: ( / /2025)\ndon vj tinh: vnd/lugng\n(oat bac fcrmua [cia ban\nbac miéng kim-phic-léc sbj 999 1 ludng\n1.902.000\n1.950.000",
    "crawled_at": "2025-11-22T16:17:52.563015Z"
  },
  {
    "url": "https://sacombank-sbj.com/blogs/bang-gia-bac/bang-ty-gia-bac-ngay-10-11-2025-bang-8",
    "title": "Bảng Tỷ Giá Bạc - Ngày 10/11/2025 - Bảng 8",
    "date": "2025-11-10",
    "silver_type": "Bạc Miếng Kim-Phúc-Lộc SBJ 999 1 lượng",
    "buy": 1896000,
    "sell": 1944000,
    "effective_time": "15:35",
    "image_url": "https://cdn.hstatic.net/200000315699/file/l8_cf1a43895cae46679770b05a66d268e9.png",
    "ocr_text": "sacombank-sbj\ncong ty vang bac ba quy\nbang gia bac\nbang: 08 ngay 10/11/2025\nhiéu luc ta: 15h35\nm 86: bm.qdtg.02a\nban hanh: ( / /2025)\ndon vj tinh: vnd/lugng\n(oat bac fcrmua [cia ban\nbac miéng kim-phic-léc sbj 999 1 ludng\n1.896.000\n1.944.000",
    "crawled_at": "2025-11-22T16:17:53.861692Z"
  },
  {
    "url": "https://sacombank-sbj.com/blogs/bang-gia-bac/bang-ty-gia-bac-ngay-10-11-2025-bang-7",
    "title": "Bảng Tỷ Giá Bạc - Ngày 10/11/2025 - Bảng 7",
    "date": "2025-11-10",
    "silver_type": "Bạc Miếng Kim-Phúc-Lộc SBJ 999 1 lượng",
    "buy": 1890000,
    "sell": 1938000,
    "effective_time": null,
    "image_url": "https://cdn.hstatic.net/200000315699/file/l7_b06e405d420f4b88866edf5022c73e8d.png",
    "ocr_text": "sacombank-sbj\ncong ty vang bac ba quy\nbang gia bac\nbang: 07 ngay 10/11/2025\nhiéu luc ta: 14155\nm 86: bm.qdtg.02a\nban hanh: ( / /2025)\ndon vj tinh: vnd/lugng\n(oat bac fcrmua [cia ban\nbac miéng kim-phic-léc sbj 999 1 ludng\n1.890.000\n1.938.000",
    "crawled_at": "2025-11-22T16:17:54.996072Z"
  },
  {
    "url": "https://sacombank-sbj.com/blogs/bang-gia-bac/bang-ty-gia-bac-ngay-10-11-2025-bang-6",
    "title": "Bảng Tỷ Giá Bạc - Ngày 10/11/2025 - Bảng 6",
    "date": "2025-11-10",
    "silver_type": "Bạc Miếng Kim-Phúc-Lộc SBJ 999 1 lượng",
    "buy": 1881000,
    "sell": 1929000,
    "effective_time": "13:18",
    "image_url": "https://cdn.hstatic.net/200000315699/file/l6_4678915842f749e39d825cd15b680b6c.png",
    "ocr_text": "sacombank-sbj ma s6: bm.qdtg.02a\ncong ty vang bac ba quy\nban hanh: ( / /2025)\nbang gia bac\nhiéu luc ta: 13h18 bon vj tinh: vnb/luong\n(oat bac fcrmua [cia ban\nbac miéng kim-phic-léc sbj 999 1 ludng 1.881.000 1.929.000",
    "crawled_at": "2025-11-22T16:17:56.486285Z"
  },
  {
    "url": "https://sacombank-sbj.com/blogs/bang-gia-bac/bang-ty-gia-bac-ngay-10-11-2025-bang-5",
    "title": "Bảng Tỷ Giá Bạc - Ngày 10/11/2025 - Bảng 5",
    "date": "2025-11-10",
    "silver_type": "Bạc Miếng Kim-Phúc-Lộc SBJ 999 1 lượng",
    "buy": 1869000,
    "sell": 1917000,
    "effective_time": null,
    "image_url": "https://cdn.hstatic.net/200000315699/file/l5_07863cb42b5049659dc4931719612fe2_master.png",
    "ocr_text": "sacombank-sbj\ncong ty vang bac da quy\nbang gia bac\nbang: 05 ngay 10/11/2025\nhiéu luce tit: 17ho5\nmé 86: bm.qdtg.02a\nban hanh: ( / /2025)\ndon vj tinh: vnd/luong\nloal bac pciamua j giaban\nbac miéng kim-phiic-l6c sbj 999 1 luong\n1,869,000\n1,917,000 |",
    "crawled_at": "2025-11-22T16:17:58.746954Z"
  },
  {
    "url": "https://sacombank-sbj.com/blogs/bang-gia-bac/bang-ty-gia-bac-ngay-10-11-2025-bang-4",
    "title": "Bảng Tỷ Giá Bạc - Ngày 10/11/2025 - Bảng 4",
    "date": "2025-11-10",
    "silver_type": "Bạc Miếng Kim-Phúc-Lộc SBJ 999 1 lượng",
    "buy": 1866000,
    "sell": 1914000,
    "effective_time": "09:12",
    "image_url": "https://cdn.hstatic.net/200000315699/file/l4_5f76970c4e244ce5bafd4a8ee3a924ca.png",
    "ocr_text": "sacombank-sbj ma s6: bm.qdtg.02a\ncong ty vang bac da quy\nban hanh: ( / /2025)\n‘s odaeseness\nbang gia bac\nhiéu luce fir: o9h12 don vi tinh: vnd/luong\nloa bag cima [cia pan\nbac miéng kim-phie-léc sbj 999 1 ludng 1.866.000 1.914.000",
    "crawled_at": "2025-11-22T16:18:00.004978Z"
  },
  {
    "url": "https://sacombank-sbj.com/blogs/bang-gia-bac/bang-ty-gia-bac-ngay-10-11-2025-bang-3",
    "title": "Bảng Tỷ Giá Bạc - Ngày 10/11/2025 - Bảng 3",
    "date": "2025-11-10",
    "silver_type": "Bạc Miếng Kim-Phúc-Lộc SBJ 999 1 lượng",
    "buy": 1869000,
    "sell": 1917000,
    "effective_time": null,
    "image_url": "https://cdn.hstatic.net/200000315699/file/l3_e5a946c6994c451e86c0d97a7cf17a71.png",
    "ocr_text": "sacombank-sbj\nbang gia bac\nbang: 03 ngdy 10/11/2025\nhiéu lye ti: 0850\nmi s6: bm.qdtg.02a\nban hanh: ( / /2025)\nbon vi tinh: vnd/luong\nloalbac ff cumua | ciaean\nbac miéng kim-phic-léc sbj 999 1 lugng\n1.869.000\n1.917.000",
    "crawled_at": "2025-11-22T16:18:01.341926Z"
  },
  {
    "url": "https://sacombank-sbj.com/blogs/bang-gia-bac/bang-ty-gia-bac-ngay-10-11-2025-bang-2",
    "title": "Bảng Tỷ Giá Bạc - Ngày 10/11/2025 - Bảng 2",
    "date": "2025-11-10",
    "silver_type": "Bạc Miếng Kim-Phúc-Lộc SBJ 999 1 lượng",
    "buy": 1860000,
    "sell": 1908000,
    "effective_time": "08:20",
    "image_url": "https://cdn.hstatic.net/200000315699/file/l2r_6539fcaf1d1f4486b0aa6726218b1d92.png",
    "ocr_text": "sacombank-sbj m4 86: bm.qdtg.02a\nban hanh: ( / /2025)\nbang gia bac\nhiéu luc ta: 08h20 bon vj tinh: vnd/lugng\nloalbac ff cumua | ciaean\nbac miéng kim-phiic-léc sbj 999 1 lung 1.860.000 1.908.000",
    "crawled_at": "2025-11-22T16:18:03.381239Z"
  },
  {
    "url": "https://sacombank-sbj.com/blogs/bang-gia-bac/bang-ty-gia-bac-ngay-10-11-2025-bang-1",
    "title": "Bảng Tỷ Giá Bạc - Ngày 10/11/2025 - Bảng 1",
    "date": "2025-11-10",
    "silver_type": "Bạc miéng Kim-phtc-Lộc sbuj 999 luro’ng .845.000 | |",
    "buy": 1845000,
    "sell": 1893000,
    "effective_time": "07:30",
    "image_url": "https://cdn.hstatic.net/200000315699/file/hinh_anh_10-11-25_luc_07.20_040df43760e74d93a570b0957fe2e017.jpeg",
    "ocr_text": "sacombank-sbj ma sé: bm.qdtg.02a\n: ban hanh: ( / /2025)\nbang gia bac\nbang: 01 ngay 10/11/2025\nhiéu luc te: 07h30 dorn vi tinh: vnd/auong\nloai bac gia mua gia ban\nbac miéng kim-phtc-l6c sbuj 999 1 luro’ng 1.845.000 | | 1.893.000",
    "crawled_at": "2025-11-22T16:18:04.911888Z"
  },
  {
    "url": "https://sacombank-sbj.com/blogs/bang-gia-bac/bang-ty-gia-bac-ngay-07-11-2025-bang-7",
    "title": "Bảng Tỷ Giá Bạc - Ngày 07/11/2025 - Bảng 7",
    "date": "2025-11-07",
    "silver_type": "Bạc Miếng Kim-Phúc-Lộc SBJ 999 1 lượng",
    "buy": 1854000,
    "sell": 1902000,
    "effective_time": "16:35",
    "image_url": "https://cdn.hstatic.net/200000315699/file/l7_3fb1c5050e634566810c8528e7cee0a7.png",
    "ocr_text": "sacombank-sbj\ns6::\nbang gia bac\nbang: 07 ngdy 07/11/2025\nhiéu lue ti: 16h35\nmi s6: bm.qdtg.02a\nban hanh: ( / /2025)\nbon vi tinh: vnd/luong\nloalbac ff cumua | ciaean\nbac miéng kim-phic-léc sbj 999 1 lugng\n1.854.000\n1.902.000",
    "crawled_at": "2025-11-22T16:18:06.016582Z"
  },
  {
    "url": "https://sacombank-sbj.com/blogs/bang-gia-bac/bang-ty-gia-bac-ngay-07-11-2025-bang-6",
    "title": "Bảng Tỷ Giá Bạc - Ngày 07/11/2025 - Bảng 6",
    "date": "2025-11-07",
    "silver_type": "Bạc Miếng Kim-Phúc-Lộc SBJ 999 1 lượng",
    "buy": 1848000,
    "sell": 1896000,
    "effective_time": "14:07",
    "image_url": "https://cdn.hstatic.net/200000315699/file/l6_5dfdbffa252542f6a0d309ea60a6ab00_master.png",
    "ocr_text": "sacombank-sbj m§ 86: bm.qdtg.02a\ncong ty vang bac da quy\nban hanh: ( / /2025)\nbang gia bac\nhiéu luce fu: 14h07 bon vi tinh: vnd/luong\nloal bac ciamua | giaban\nbac miéng kim-phiic-l6c sbj 999 1 luong 1,848,000 1,896,000",
    "crawled_at": "2025-11-22T16:18:07.711214Z"
  },
  {
    "url": "https://sacombank-sbj.com/blogs/bang-gia-bac/bang-ty-gia-bac-ngay-07-11-2025-bang-5",
    "title": "Bảng Tỷ Giá Bạc - Ngày 07/11/2025 - Bảng 5",
    "date": "2025-11-07",
    "silver_type": "Bạc Miếng Kim-Phúc-Lộc SBJ 999 1 lượng",
    "buy": 1842000,
    "sell": 1890000,
    "effective_time": "13:15",
    "image_url": "https://cdn.hstatic.net/200000315699/file/l5_1766bd588b304b43b2731e20bacbc9c5_master.png",
    "ocr_text": "sacombank- sbj mg s6: bm.qdtg.02a\ncong ty vang bac da quy\nban hanh: ( / /2025)\nbang gia bac\nhiéu lue fu: 13h15 bon vi tinh: vnd/luong\nloal bac ciamua | giaban\nbac miéng kim-phiic-l6c sbj 999 1 luong 1,842,000 1,890,000",
    "crawled_at": "2025-11-22T16:18:09.079829Z"
  },
  {
    "url": "https://sacombank-sbj.com/blogs/bang-gia-bac/bang-ty-gia-bac-ngay-07-11-2025-bang-4",
    "title": "Bảng Tỷ Giá Bạc - Ngày 07/11/2025 - Bảng 4",
    "date": "2025-11-07",
    "silver_type": "Bạc Miếng Kim-Phúc-Lộc SBJ 999 1 lượng",
    "buy": 1836000,
    "sell": 1884000,
    "effective_time": "10:05",
    "image_url": "https://cdn.hstatic.net/200000315699/file/l4_0ae62512070e4b1d890636518ba35e50_master.png",
    "ocr_text": "sacombank-sbj mé s6: bm.qdtg.02a\ncong ty vang bac da quy\nban hanh: ( / /2025)\nbang gia bac\nhiéu luce fu: 10h05 bon vj tinh: vnb/luong\nloal bac ciamua | giaban\nbac miéng kim-phiic-l6c sbj 999 1 luong 1,836,000 1,884,000",
    "crawled_at": "2025-11-22T16:18:11.000404Z"
  },
  {
    "url": "https://sacombank-sbj.com/blogs/bang-gia-bac/bang-ty-gia-bac-ngay-07-11-2025-bang-3",
    "title": "Bảng Tỷ Giá Bạc - Ngày 07/11/2025 - Bảng 3",
    "date": "2025-11-07",
    "silver_type": "Bạc Miếng Kim-Phúc-Lộc SBJ 999 1 lượng",
    "buy": 1842000,
    "sell": 1890000,
    "effective_time": "09:35",
    "image_url": "https://cdn.hstatic.net/200000315699/file/l3r_1e6769c3835447808e69b15aee410704.png",
    "ocr_text": "sacombank-sbj\ncong ty vang bac ba quy\nbang gia bac\nbang: 03 ngay 07/11/2025\nhiéu luc ta: 09h35\nm 86: bm.qdtg.02a\nban hanh: ( / /2025)\ndon vj tinh: vnd/lugng\n(oat bac fcrmua [cia ban\nbac miéng kim-phic-léc sbj 999 1 ludng\n1.842.000\n1.890.000",
    "crawled_at": "2025-11-22T16:18:12.095237Z"
  },
  {
    "url": "https://sacombank-sbj.com/blogs/bang-gia-bac/bang-ty-gia-bac-ngay-07-11-2025-bang-2",
    "title": "Bảng Tỷ Giá Bạc - Ngày 07/11/2025 - Bảng 2",
    "date": "2025-11-07",
    "silver_type": "Bạc Miếng Kim-Phúc-Lộc SBJ 999 1 lượng",
    "buy": 1836000,
    "sell": 1884000,
    "effective_time": "08:35",
    "image_url": "https://cdn.hstatic.net/200000315699/file/f16dbbbbe9bd65e33cac_40474778592a4af493faa6bf7c271967.jpg",
    "ocr_text": "sacombank -sbj m4 86: bm.qdtg.02a\nban hanh: ( / /2025)\nbang gia bac\nhiéu luc ta: 08h35 bon vj tinh: vnd/lugng\nwoatsac | giamua | cia ban\nbac miéng kim-phiic-léc sbj 999 1 luong 1,836,000 1,884,000",
    "crawled_at": "2025-11-22T16:18:13.324695Z"
  },
  {
    "url": "https://sacombank-sbj.com/blogs/bang-gia-bac/bang-ty-gia-bac-ngay-07-11-2025-bang-1",
    "title": "Bảng Tỷ Giá Bạc - Ngày 07/11/2025 - Bảng 1",
    "date": "2025-11-07",
    "silver_type": "Bạc Miếng Kim-Phúc-Lộc SBJ 999 iu’o’ng",
    "buy": 1839000,
    "sell": 1887000,
    "effective_time": "07:30",
    "image_url": "https://cdn.hstatic.net/200000315699/file/hinh_anh_7-11-25_luc_07.21_cd6a503f61ee4b11ab86a9948c4ab43d.jpeg",
    "ocr_text": "sacombank-sbj ma s6: bm.qdtg.02a\ncong ty vang bac ba quy ban hanh: ( / 12025)\nbang gia bac\nbang: 01 ngay 07/11/2025\nhiéu luc tie: 07h30 don vj tinh: vnd/lureng\nloa bac [caus | giaban\nbac miéng kim-phtic-l6c sbj 999 1 iu’o’ng 1.839.000 1.887.000",
    "crawled_at": "2025-11-22T16:18:14.511430Z"
  },
  {
    "url": "https://sacombank-sbj.com/blogs/bang-gia-bac/bang-ty-gia-bac-ngay-06-11-2025-bang-8",
    "title": "Bảng Tỷ Giá Bạc - Ngày 06/11/2025 - Bảng 8",
    "date": "2025-11-06",
    "silver_type": "Bạc Miếng Kim-Phúc-Lộc SBJ 999 1 lượng",
    "buy": 1854000,
    "sell": 1902000,
    "effective_time": "17:10",
    "image_url": "https://cdn.hstatic.net/200000315699/file/l8_9f9edae6b2fa457daabc9027d0164c2b_master.png",
    "ocr_text": "sacombank-sbj ma s6: bm.qdtg.02a\ncong ty vang bac ba quy\nban hanh: ( / /2025)\nbang gia bac\nhiéu luc tir: 17h10 don vi tinh: vnd/liwong\nloai bac gia mua gia ban\nbac miéng kim-phic-léc sbj 999 1 lugng 1,854,000 1,902,000",
    "crawled_at": "2025-11-22T16:18:15.689646Z"
  },
  {
    "url": "https://sacombank-sbj.com/blogs/bang-gia-bac/bang-ty-gia-bac-ngay-06-11-2025-bang-7",
    "title": "Bảng Tỷ Giá Bạc - Ngày 06/11/2025 - Bảng 7",
    "date": "2025-11-06",
    "silver_type": "Bạc Miếng Kim-Phúc-Lộc SBJ 999 lwgng",
    "buy": 1851000,
    "sell": 1899000,
    "effective_time": null,
    "image_url": "https://cdn.hstatic.net/200000315699/file/l7_7be8cf23239441519bb4a1fd1f679b75_master.png",
    "ocr_text": "sacombank-sbj mé& 86: bm.qdtg.02a\nban hanh: ( / /2025)\nbang gia bac\nbang: 07 ngdy 06/11/2025\nhiu tye tit: 15n55 don vj tinh: vnd/lirong\ncams | _ciinin\nbac miéng kim-phic-léc sbj 999 1 lwgng 1,851,000 1,899,000",
    "crawled_at": "2025-11-22T16:18:16.832315Z"
  },
  {
    "url": "https://sacombank-sbj.com/blogs/bang-gia-bac/bang-ty-gia-bac-ngay-06-11-2025-bang-6",
    "title": "Bảng Tỷ Giá Bạc - Ngày 06/11/2025 - Bảng 6",
    "date": "2025-11-06",
    "silver_type": "Bạc Miếng Kim-Phúc-Lộc SBJ 999 lwgng",
    "buy": 1842000,
    "sell": 1890000,
    "effective_time": null,
    "image_url": "https://cdn.hstatic.net/200000315699/file/l6_afbcaf32e4c04a97970ffb7210e4ef58_master.png",
    "ocr_text": "sacombank-sbj mé& 86: bm.qdtg.02a\nban hanh: ( / /2025)\nbang gia bac\nhiéu tye tit: 14n05 don vj tinh: vnd/lirong\ncams | _ciinin\nbac miéng kim-phic-léc sbj 999 1 lwgng 1,842,000 1,890,000\ns6:.",
    "crawled_at": "2025-11-22T16:18:17.941758Z"
  },
  {
    "url": "https://sacombank-sbj.com/blogs/bang-gia-bac/bang-ty-gia-bac-ngay-06-11-2025-bang-5",
    "title": "Bảng Tỷ Giá Bạc - Ngày 06/11/2025 - Bảng 5",
    "date": "2025-11-06",
    "silver_type": "Bạc Miếng Kim-Phúc-Lộc SBJ 999 lwgng",
    "buy": 1839000,
    "sell": 1887000,
    "effective_time": "13:10",
    "image_url": "https://cdn.hstatic.net/200000315699/file/l5_17218ee421ae451e9a6b155da79dea49_master.png",
    "ocr_text": "sacombank-sbj mé& 86: bm.qdtg.02a\nban hanh: ( / /2025)\nbang gia bac\nbang: 05 ngdy 06/11/2025\nhiéu tye tit: 13h10 don vj tinh: vnd/lirong\ncams | _ciinin\nbac miéng kim-phic-léc sbj 999 1 lwgng 1,839,000 1,887,000",
    "crawled_at": "2025-11-22T16:18:19.676737Z"
  },
  {
    "url": "https://sacombank-sbj.com/blogs/bang-gia-bac/bang-ty-gia-bac-ngay-06-11-2025-bang-4",
    "title": "Bảng Tỷ Giá Bạc - Ngày 06/11/2025 - Bảng 4",
    "date": "2025-11-06",
    "silver_type": "Bạc Miếng Kim-Phúc-Lộc SBJ 999 1 lượng",
    "buy": 1833000,
    "sell": 1881000,
    "effective_time": "10:55",
    "image_url": "https://cdn.hstatic.net/200000315699/file/l4_1ddd268dd2fc465a87207ad7960d5ac6.png",
    "ocr_text": "sacombank-sbj mas6: bm.qdtg.02a\nban hanh: ( / /2025)\naw,\nsol.. cece\nbang gia bac\nhiéu luce tit: 10h55 don vj tinh: vnd/luong\n(oal bac ff cmua | clasan\nbac miéng kim-phuc-léc sbj 999 1 luong 1.833.000 1.881.000",
    "crawled_at": "2025-11-22T16:18:20.908720Z"
  },
  {
    "url": "https://sacombank-sbj.com/blogs/bang-gia-bac/bang-ty-gia-bac-ngay-06-11-2025-bang-3",
    "title": "Bảng Tỷ Giá Bạc - Ngày 06/11/2025 - Bảng 3",
    "date": "2025-11-06",
    "silver_type": "Bạc Miếng Kim-phiie-Lộc SBJ 999 lwgng",
    "buy": 1821000,
    "sell": 1869000,
    "effective_time": null,
    "image_url": "https://cdn.hstatic.net/200000315699/file/l3_6ce2d893c8bb4e7e8524b27d4fedffe2_master.png",
    "ocr_text": "\\sacombank-sbj\n(cena fyvane axe of auy ‘mé sé: bm.qdtg.024\nban hanh:( / 12025)\nbang gia bac\ndon vi tinh: vnd/heong\ngia mua gia ban\nbac miéng kim-phiie-léc sbj 999 1 lwgng 1,821,000 1,869,000",
    "crawled_at": "2025-11-22T16:18:21.971515Z"
  },
  {
    "url": "https://sacombank-sbj.com/blogs/bang-gia-bac/bang-ty-gia-bac-ngay-06-11-2025-bang-2",
    "title": "Bảng Tỷ Giá Bạc - Ngày 06/11/2025 - Bảng 2",
    "date": "2025-11-06",
    "silver_type": null,
    "buy": 1827000,
    "sell": 1875000,
    "effective_time": null,
    "image_url": "https://cdn.hstatic.net/200000315699/file/l2_099d39eacdbb43a0a38baa0bf2cffe78_master.png",
    "ocr_text": "sacombank-sbj\n36: bm.qdtg.02a\n(1 (2025)\ns6:\nbang gia bac\nbang: 02 ngay 0611/2025\n“higa ie tit: 08113 bony tink: pnb/heong\nloai bac gia mua gia ban\n1c sbi 999 1 lweng 1,827,000 1,875,000\n|bac miéng kim-phac-]",
    "crawled_at": "2025-11-22T16:18:22.930718Z"
  },
  {
    "url": "https://sacombank-sbj.com/blogs/bang-gia-bac/bang-ty-gia-bac-ngay-06-11-2025-bang-1",
    "title": "Bảng Tỷ Giá Bạc - Ngày 06/11/2025 - Bảng 1",
    "date": "2025-11-06",
    "silver_type": "Bạc Miếng Kim-phuic-l6éc SBJ 999 iu’o’ng .824.000",
    "buy": 1824000,
    "sell": 1872000,
    "effective_time": "07:30",
    "image_url": "https://cdn.hstatic.net/200000315699/file/hinh_anh_6-11-25_luc_07.19_07dd9c7744ff4cf1bff1e87dc0e8247b.jpeg",
    "ocr_text": "sacombank-sbj ma sé: bm.qdtg.02a\ncong ty vang bac ba quy ban hanh: ( / /2025)\nbang gia bac\nbang: 01 ngay 06/11/2025\nhiéu luc tie: 07h30 don vj tinh: vndauo‘ng\nloa bac [caus ciaban\nbac miéng kim-phuic-l6éc sbu 999 1 iu’o’ng 1.824.000 | 1.872.000",
    "crawled_at": "2025-11-22T16:18:24.231948Z"
  },
  {
    "url": "https://sacombank-sbj.com/blogs/bang-gia-bac/bang-ty-gia-bac-ngay-05-11-2025-bang-9",
    "title": "Bảng Tỷ Giá Bạc - Ngày 05/11/2025 - Bảng 9",
    "date": "2025-11-05",
    "silver_type": "Bạc Miếng Kim-Phúc-Lộc SBJ 999 lwgng",
    "buy": 1815000,
    "sell": 1863000,
    "effective_time": "14:30",
    "image_url": "https://cdn.hstatic.net/200000315699/file/l9._966f4efbaf7149ca96fe3d0a1ab6297d_master.png",
    "ocr_text": "sacombank-sbj ma 86: bm.qdtg.02a\nnbank-sbj igs\nso...\na aba\nbang gia bac\nbang: 09 ngay 05/11/2025\n\\hiéu luce tits 14h30 don vj tinh: vnd/trong\ncams | _ciinin\nbac miéng kim-phuc-léc sbj 999 1 lwgng 1,815,000 1,863,000",
    "crawled_at": "2025-11-22T16:18:25.791012Z"
  },
  {
    "url": "https://sacombank-sbj.com/blogs/bang-gia-bac/bang-ty-gia-bac-ngay-05-11-2025-bang-8",
    "title": "Bảng Tỷ Giá Bạc - Ngày 05/11/2025 - Bảng 8",
    "date": "2025-11-05",
    "silver_type": "Bạc Miếng Kim-Phúc-Lộc SBJ 999 1 lượng",
    "buy": 1821000,
    "sell": 1869000,
    "effective_time": "13:55",
    "image_url": "https://cdn.hstatic.net/200000315699/file/l8_2d800f8675a1455da1da98dfc810afbf_master.png",
    "ocr_text": "sacombank-sbj mg s6: bm.qdtg.02a\ncong ty vang bac da quy\nban hanh: ( / /2025)\nbang gia bac\nhiéu lue fi: 13h55 bon vj tinh: vnd/luong\nloal bac /ciamua | giaban\nbac miéng kim-phic-l6c sbj 999 1 luong 1,821,000 1,869,000",
    "crawled_at": "2025-11-22T16:18:27.633220Z"
  },
  {
    "url": "https://sacombank-sbj.com/blogs/bang-gia-bac/bang-ty-gia-bac-ngay-05-11-2025-bang-7",
    "title": "Bảng Tỷ Giá Bạc - Ngày 05/11/2025 - Bảng 7",
    "date": "2025-11-05",
    "silver_type": "Bạc Miếng Kim-Phúc-Lộc SBJ 999 1 lượng",
    "buy": 1818000,
    "sell": 1866000,
    "effective_time": "13:10",
    "image_url": "https://cdn.hstatic.net/200000315699/file/l7_804b9fad912047a68ac4532d54f29cf2.png",
    "ocr_text": "sacombank-sbj ma s6: bm.qdtg.02a\ncong ty vang bac da quy\nban hanh: ( / /2025)\n‘s odaeseness\nbang gia bac\nhiéu lue tir: 13h10 don vi tinh: vnd/luong\nloa bag cima [cia pan\nbac miéng kim-phie-léc sbj 999 1 ludng 1.818.000 1.866.000",
    "crawled_at": "2025-11-22T16:18:32.807818Z"
  },
  {
    "url": "https://sacombank-sbj.com/blogs/bang-gia-bac/bang-ty-gia-bac-ngay-05-11-2025-bang-6",
    "title": "Bảng Tỷ Giá Bạc - Ngày 05/11/2025 - Bảng 6",
    "date": "2025-11-05",
    "silver_type": "Bạc Miếng Kim-Phúc-Lộc SBJ 999 1 lượng",
    "buy": 1812000,
    "sell": 1860000,
    "effective_time": "10:25",
    "image_url": "https://cdn.hstatic.net/200000315699/file/l6_32934089ff594e62951215953ad27e9d.png",
    "ocr_text": "sacombank-sbj mas: bm.qdtg.02a\ncong ty vang bac da quy\nban hanh: ( / /2025)\n‘s odaeseness\nbang gia bac\nhiéu lue tir: 10h25 don vi tinh: vnd/luong\nloa bag cima [cia pan\nbac miéng kim-phie-léc sbj 999 1 ludng 1.812.000 1.860.000",
    "crawled_at": "2025-11-22T16:18:34.026633Z"
  },
  {
    "url": "https://sacombank-sbj.com/blogs/bang-gia-bac/bang-ty-gia-bac-ngay-05-11-2025-bang-5",
    "title": "Bảng Tỷ Giá Bạc - Ngày 05/11/2025 - Bảng 5",
    "date": "2025-11-05",
    "silver_type": "Bạc Miếng Kim-Phúc-Lộc SBJ 999 1 lượng",
    "buy": 1806000,
    "sell": 1854000,
    "effective_time": "10:15",
    "image_url": "https://cdn.hstatic.net/200000315699/file/l5_0e3bd92d8dfd4800b00ffd0e001fa84e.png",
    "ocr_text": "sacombank-sbj\ncong ty vang bac ba quy\nbang gia bac\nbang: 05 ngay 05/11/2025\nhiéu luc ta: 10h15\nm 86: bm.qdtg.02a\nban hanh: ( / /2025)\ndon vj tinh: vnd/lugng\n(oat bac fcrmua [cia ban\nbac miéng kim-phic-léc sbj 999 1 ludng\n1.806.000\n1.854.000",
    "crawled_at": "2025-11-22T16:18:35.282698Z"
  },
  {
    "url": "https://sacombank-sbj.com/blogs/bang-gia-bac/bang-ty-gia-bac-ngay-05-11-2025-bang-4",
    "title": "Bảng Tỷ Giá Bạc - Ngày 05/11/2025 - Bảng 4",
    "date": "2025-11-05",
    "silver_type": "Bạc Miếng Kim-Phúc-Lộc SBJ 999 1 lượng",
    "buy": 1794000,
    "sell": 1842000,
    "effective_time": "09:35",
    "image_url": "https://cdn.hstatic.net/200000315699/file/l4_f9dd333f333e4eae802efdd00a8bbbf8.png",
    "ocr_text": "sacombank-sbj\ncong ty vang bac ba quy\nbang gia bac\nbang: 04 ngday 05/11/2025\nhiéu luc ta: 09h35\nm 86: bm.qdtg.02a\nban hanh: ( / /2025)\ndon vj tinh: vnd/lugng\n(oat bac fcrmua [cia ban\nbac miéng kim-phic-léc sbj 999 1 ludng\n1.794.000\n1.842.000",
    "crawled_at": "2025-11-22T16:18:37.338692Z"
  },
  {
    "url": "https://sacombank-sbj.com/blogs/bang-gia-bac/bang-ty-gia-bac-ngay-05-11-2025-bang-3",
    "title": "Bảng Tỷ Giá Bạc - Ngày 05/11/2025 - Bảng 3",
    "date": "2025-11-05",
    "silver_type": "Bạc Miếng Kim-Phúc-Lộc SBJ 999 1 lượng",
    "buy": 1797000,
    "sell": 1845000,
    "effective_time": "08:45",
    "image_url": "https://cdn.hstatic.net/200000315699/file/l3_38f9a3ccb8e34283bfe07875b3687af4_master.png",
    "ocr_text": "sacombank-sbj ma s6: bm.qdtg.02a\ncong ty vang bac da quy\nban hanh: ( / /2025)\nbang gia bac\nhiéu luce fu: 08h45 bon vj tinh: vnd/luong\nloal bac /ciamua | giaban\nbac miéng kim-phic-l6c sbj 999 1 luong 1,797,000 1,845,000",
    "crawled_at": "2025-11-22T16:18:38.626813Z"
  },
  {
    "url": "https://sacombank-sbj.com/blogs/bang-gia-bac/bang-ty-gia-bac-ngay-05-11-2025-bang-12",
    "title": "Bảng Tỷ Giá Bạc - Ngày 05/11/2025 - Bảng 12",
    "date": "2025-11-05",
    "silver_type": "Bạc Miếng Kim-Phúc-Lộc SBJ 999 1 lượng",
    "buy": 1818000,
    "sell": 1866000,
    "effective_time": "17:10",
    "image_url": "https://cdn.hstatic.net/200000315699/file/l12_79696313fc87415487c8137559e889b0_master.png",
    "ocr_text": "sacombank-sbj\nso...\nbang gia bac\nbang: 12 ngdy 05/11/2025\nluge tie: 17h10\nmi s6: bm.qdtg.02a\nban hanh: ( / /2025)\ndon vj tinh: vnd/lirong\ncams | _ciinin\nbac miéng kim-phic-léc sbj 999 1 long\n1,818,000\n1,866,000",
    "crawled_at": "2025-11-22T16:18:39.810891Z"
  },
  {
    "url": "https://sacombank-sbj.com/blogs/bang-gia-bac/bang-ty-gia-bac-ngay-05-11-2025-bang-11",
    "title": "Bảng Tỷ Giá Bạc - Ngày 05/11/2025 - Bảng 11",
    "date": "2025-11-05",
    "silver_type": "Bạc Miếng Kim-Phúc-Lộc SBJ 999 1 lượng",
    "buy": 1812000,
    "sell": 1860000,
    "effective_time": null,
    "image_url": "https://cdn.hstatic.net/200000315699/file/l11_424d4956dcd445379b09b797dbf165f5_master.png",
    "ocr_text": "sacombank-sbj\ns6:.\nbang gia bac\nbang: 11 ngdy 05/11/2025\nhiéu tye tit: 16n55\ncams | _ciinin\nmi s6: bm.qdtg.02a\nban hanh: ( / /2025)\ndon vj tinh: vnd/lirong\nbac miéng kim-phic-léc sbj 999 1 long\n1,812,000\n1,860,000",
    "crawled_at": "2025-11-22T16:18:43.630198Z"
  },
  {
    "url": "https://sacombank-sbj.com/blogs/bang-gia-bac/bang-ty-gia-bac-ngay-05-11-2025-bang-10",
    "title": "Bảng Tỷ Giá Bạc - Ngày 05/11/2025 - Bảng 10",
    "date": "2025-11-05",
    "silver_type": "Bạc Miếng Kim-Phúc-Lộc SBJ 999 lwgng",
    "buy": 1824000,
    "sell": 1872000,
    "effective_time": "16:00",
    "image_url": "https://cdn.hstatic.net/200000315699/file/l10_fcf5c024ae99417c87f1d1b35ac1cdb7_master.png",
    "ocr_text": "sacombank-sbj ma 86: bm.qdtg.02a\nnbank-sbj igs\nsor...\na aba\nbang gia bac\nbang: 10 ngdy 05/11/2025\nhiéu tye tit: 16h00 don vj tinh: vnd/trong\ncams | _ciinin\nbac miéng kim-phic-léc sbj 999 1 lwgng 1,824,000 1,872,000",
    "crawled_at": "2025-11-22T16:18:45.830650Z"
  },
  {
    "url": "https://sacombank-sbj.com/blogs/bang-gia-bac/bang-ty-gia-bac-ngay-05-11-2025-bang-2",
    "title": "Bảng Tỷ Giá Bạc - Ngày 05/11/2025 - Bảng 2",
    "date": "2025-11-05",
    "silver_type": "Bạc Miếng Kim-Phúc-Lộc SBJ 999 1 lượng ,796,000",
    "buy": 1796000,
    "sell": 1844000,
    "effective_time": "08:33",
    "image_url": "https://cdn.hstatic.net/200000315699/file/l2_514eada88cc94fbb9159500d8e169482_master.png",
    "ocr_text": "sacombank-sbj ma s6: bm.qdtg.02a\ncong ty vang bac da quy\nban hanh: ( / /2025)\nbang gia bac\nhiéu lue fu: 08h33 bon vj tinh: vnd/luong\nloal bac | cimua j giaban\nbac miéng kim-phic-l6c sbj 999 1 luong 1,796,000 | 1,844,000",
    "crawled_at": "2025-11-22T16:18:47.911419Z"
  },
  {
    "url": "https://sacombank-sbj.com/blogs/bang-gia-bac/bang-ty-gia-bac-ngay-05-11-2025-bang-1",
    "title": "Bảng Tỷ Giá Bạc - Ngày 05/11/2025 - Bảng 1",
    "date": "2025-11-05",
    "silver_type": "Bạc Miếng Kim-Phúc-Lộc SBJ 999 luo’ng",
    "buy": 1809000,
    "sell": 1857000,
    "effective_time": "07:30",
    "image_url": "https://cdn.hstatic.net/200000315699/file/hinh_anh_5-11-25_luc_07.23_efd742ec2f5b4af780f7de38088fc5b9.jpeg",
    "ocr_text": "sacombank-sbj ma s6: bm.qdtg.02a\ntie ne selenicty bap nanhey 72026)\nbang gia bac\nbang: 01 ngay 05/11/2025\nhiéu lye tie: 07h30 bon vj tinh: vnd/lurong\nloai bag [_ckmua | giaban\nbac miéng kim-phic-léc sbj 999 1 luo’ng 1.809.000 1.857.000",
    "crawled_at": "2025-11-22T16:18:49.068133Z"
  },
  {
    "url": "https://sacombank-sbj.com/blogs/bang-gia-bac/bang-ty-gia-bac-ngay-04-11-2025-bang-7",
    "title": "Bảng Tỷ Giá Bạc - Ngày 04/11/2025 - Bảng 7",
    "date": "2025-11-04",
    "silver_type": "Bạc Miếng Kim-Phúc-Lộc SBJ 999 1 lượng",
    "buy": 1824000,
    "sell": 1872000,
    "effective_time": "16:55",
    "image_url": "https://cdn.hstatic.net/200000315699/file/l7_f1d0003d577f4f3da155fcc5deb33686.png",
    "ocr_text": "sacombank-sbj mas6: bm.qdtg.02a\nban hanh: ( / /2025)\naw,\nsol.. cece\nbang gia bac\nhiéu luce ti: 16h55 don vj tinh: vnd/luong\n(oal bac ff cmua | clasan\nbac miéng kim-phuc-léc sbj 999 1 luong 1.824.000 1.872.000",
    "crawled_at": "2025-11-22T16:18:51.086558Z"
  },
  {
    "url": "https://sacombank-sbj.com/blogs/bang-gia-bac/bang-ty-gia-bac-ngay-04-11-2025-bang-6",
    "title": "Bảng Tỷ Giá Bạc - Ngày 04/11/2025 - Bảng 6",
    "date": "2025-11-04",
    "silver_type": "Bạc Miếng Kim-Phúc-Lộc SBJ 999 1 lượng",
    "buy": 1827000,
    "sell": 1875000,
    "effective_time": "16:08",
    "image_url": "https://cdn.hstatic.net/200000315699/file/l6_c78bd2ec6b634b4ab67b89b10291aacb.png",
    "ocr_text": "sacombank-sbj mas6: bm.qdtg.02a\nban hanh: ( / /2025)\naw,\nsol.. cece\nbang gia bac\nhiéu luc ti: 16h08 don vj tinh: vnd/luong\n(oal bac ff cmua | clasan\nbac miéng kim-phuc-léc sbj 999 1 luong 1.827.000 1.875.000",
    "crawled_at": "2025-11-22T16:18:52.342880Z"
  },
  {
    "url": "https://sacombank-sbj.com/blogs/bang-gia-bac/bang-ty-gia-bac-ngay-04-11-2025-bang-5",
    "title": "Bảng Tỷ Giá Bạc - Ngày 04/11/2025 - Bảng 5",
    "date": "2025-11-04",
    "silver_type": "Bạc Miếng Kim-Phúc-Lộc SBJ 999 1 lượng",
    "buy": 1812000,
    "sell": 1860000,
    "effective_time": "13:25",
    "image_url": "https://cdn.hstatic.net/200000315699/file/l5_55a934294d414146aea98315a857ef96.png",
    "ocr_text": "sacombank-sbj ma s6: bm.qdtg.02a\ncong ty vang bac da quy\nban hanh: ( / /2025)\n‘s odaeseness\nbang gia bac\nhiéu luce tir: 13h25 don vi tinh: vnd/luong\nloa bag cima [cia pan\nbac miéng kim-phie-léc sbj 999 1 ludng 1.812.000 1.860.000",
    "crawled_at": "2025-11-22T16:18:53.468345Z"
  },
  {
    "url": "https://sacombank-sbj.com/blogs/bang-gia-bac/bang-ty-gia-bac-ngay-04-11-2025-bang-4",
    "title": "Bảng Tỷ Giá Bạc - Ngày 04/11/2025 - Bảng 4",
    "date": "2025-11-04",
    "silver_type": "Bạc Miếng Kim-Phúc-Lộc SBJ 999 1 lượng",
    "buy": 1833000,
    "sell": null,
    "effective_time": "10:50",
    "image_url": "https://cdn.hstatic.net/200000315699/file/l4_4cbef1a8a9b544cf93ca474ed0476faa.png",
    "ocr_text": "sacombank-sbj\nbang gia bac\nbang: 04 ngdy 04/11/2025\nhiéu lue ti: 10h50\nmi s6: bm.qdtg.02a\nban hanh: ( / /2025)\nbon vi tinh: vnd/luong\nloalbac ff cumua | ciaean\nbac miéng kim-phic-léc sbj 999 1 lugng\n1.833.000",
    "crawled_at": "2025-11-22T16:18:58.843079Z"
  },
  {
    "url": "https://sacombank-sbj.com/blogs/bang-gia-bac/bang-ty-gia-bac-ngay-04-11-2025-bang-3",
    "title": "Bảng Tỷ Giá Bạc - Ngày 04/11/2025 - Bảng 3",
    "date": "2025-11-04",
    "silver_type": "Bạc Miếng Kim-Phúc-Lộc SBJ 999 1 lượng",
    "buy": 1827000,
    "sell": 1875000,
    "effective_time": "09:50",
    "image_url": "https://cdn.hstatic.net/200000315699/file/l3_45870cb4da3a475298586af754d65c8b.png",
    "ocr_text": "sacombank-sbj ma s6: bm.qdtg.02a\ncong ty vang bac da quy\nban hanh: ( / /2025)\n‘s odaeseness\nbang gia bac\nhiéu luce fir: 09h50 don vi tinh: vnd/luong\nloa bag cima [cia pan\nbac miéng kim-phie-léc sbj 999 1 ludng 1.827.000 1.875.000",
    "crawled_at": "2025-11-22T16:18:59.929749Z"
  },
  {
    "url": "https://sacombank-sbj.com/blogs/bang-gia-bac/bang-ty-gia-bac-ngay-04-11-2025-bang-2",
    "title": "Bảng Tỷ Giá Bạc - Ngày 04/11/2025 - Bảng 2",
    "date": "2025-11-04",
    "silver_type": "Bạc Miếng Kim-Phúc-Lộc SBJ 999 1 lượng",
    "buy": 1833000,
    "sell": 1881000,
    "effective_time": "08:55",
    "image_url": "https://cdn.hstatic.net/200000315699/file/l2_c7cc65c62f4a4c0aa059c87ec971fba8.png",
    "ocr_text": "sacombank-sbj mas6: bm.qdtg.02a\nban hanh: ( / /2025)\nbang gia bac\nhiéu luce tit: 08h55 don vj tinh: vnd/luong\n(oal bac ff cmua | clasan\nbac miéng kim-phuc-léc sbj 999 1 luong 1.833.000 1.881.000",
    "crawled_at": "2025-11-22T16:19:01.171824Z"
  },
  {
    "url": "https://sacombank-sbj.com/blogs/bang-gia-bac/bang-ty-gia-bac-ngay-04-11-2025-bang-1",
    "title": "Bảng Tỷ Giá Bạc - Ngày 04/11/2025 - Bảng 1",
    "date": "2025-11-04",
    "silver_type": "Bạc Miếng Kim-Phúc-Lộc SBJ 999 lu’orng",
    "buy": 1848000,
    "sell": 1896000,
    "effective_time": "07:30",
    "image_url": "https://cdn.hstatic.net/200000315699/file/hinh_anh_4-11-25_luc_07.26_5ea00b6a820843249eb82544b36aa6af.jpeg",
    "ocr_text": "sacombank-sbj mé s6: bm.qdtg.02a\ncong ty vang bac da quy ban hanh: ( 7/2025)\n> v4\nbang gia bac\nbang: 01 ngay 04/11/2025\nhiéu luc tiv: 07h30 don vj tinh: vnd/auwong\nloal bac rs\nbac miéng kim-phtic-léc sbu 999 1 lu’orng | 1.848.000 1.896.000",
    "crawled_at": "2025-11-22T16:19:02.550404Z"
  },
  {
    "url": "https://sacombank-sbj.com/blogs/bang-gia-bac/bang-ty-gia-bac-ngay-03-11-2025-bang-8",
    "title": "Bảng Tỷ Giá Bạc - Ngày 03/11/2025 - Bảng 8",
    "date": "2025-11-03",
    "silver_type": "Bạc Miếng Kim-Phúc-Lộc SBJ 999 1 lượng",
    "buy": 1863000,
    "sell": 1911000,
    "effective_time": "16:25",
    "image_url": "https://cdn.hstatic.net/200000315699/file/l8_44109a401108437fbc82efe5f8bdcad7.png",
    "ocr_text": "sacombank-sbj mas: bm.qdtg.02a\ncong ty vang bac da quy\nban hanh: ( / /2025)\n‘s odaeseness\nbang gia bac\nhiéu luce tir: 16h25 don vi tinh: vnd/luong\nloa bag cima [cia pan\nbac miéng kim-phie-léc sbj 999 1 ludng 1.863.000 1.911.000",
    "crawled_at": "2025-11-22T16:19:03.971597Z"
  },
  {
    "url": "https://sacombank-sbj.com/blogs/bang-gia-bac/bang-ty-gia-bac-ngay-03-11-2025-bang-7",
    "title": "Bảng Tỷ Giá Bạc - Ngày 03/11/2025 - Bảng 7",
    "date": "2025-11-03",
    "silver_type": "Bạc Miếng Kim-Phúc-Lộc SBJ 999 1 lượng",
    "buy": 1869000,
    "sell": 1917000,
    "effective_time": "15:10",
    "image_url": "https://cdn.hstatic.net/200000315699/file/l7r_c80085fea4f244a1bfae316e6bdb8e14.png",
    "ocr_text": "sacombank-sbj ma s6: bm.qdtg.02a\nban hanh: ( / /2025)\n~,\nsor iiv.s000\nbang gia bac\nhiéu luc ta: 15h10 don vi tinh: vnd/luong\n(oai bac cima | claban\nbac miéng kim-phic-l6c sbj 999 1 luong 1.869.000 1.917.000",
    "crawled_at": "2025-11-22T16:19:10.647422Z"
  },
  {
    "url": "https://sacombank-sbj.com/blogs/bang-gia-bac/bang-ty-gia-bac-ngay-03-11-2025-bang-6",
    "title": "Bảng Tỷ Giá Bạc - Ngày 03/11/2025 - Bảng 6",
    "date": "2025-11-03",
    "silver_type": "Bạc Miếng Kim-Phúc-Lộc SBJ 999 1 lượng",
    "buy": 1863000,
    "sell": 1911000,
    "effective_time": "13:15",
    "image_url": "https://cdn.hstatic.net/200000315699/file/l6_0ed9de0cefc64310a505008d3a38e315.png",
    "ocr_text": "sacombank-sbj mas6: bm.qdtg.02a\nban hanh: ( / /2025)\naw,\nsol.. cece\nbang gia bac\nhiéu luce tit: 13h15 don vj tinh: vnd/luong\n(oal bac ff cmua | clasan\nbac miéng kim-phuc-léc sbj 999 1 luong 1.863.000 1.911.000",
    "crawled_at": "2025-11-22T16:19:11.784435Z"
  },
  {
    "url": "https://sacombank-sbj.com/blogs/bang-gia-bac/bang-ty-gia-bac-ngay-03-11-2025-bang-5",
    "title": "Bảng Tỷ Giá Bạc - Ngày 03/11/2025 - Bảng 5",
    "date": "2025-11-03",
    "silver_type": "Bạc Miếng Kim-Phúc-Lộc SBJ 999 1 lượng",
    "buy": 1860000,
    "sell": 1908000,
    "effective_time": "10:50",
    "image_url": "https://cdn.hstatic.net/200000315699/file/l5_990f20d6623043f9b1bc3d83f337371f.png",
    "ocr_text": "sacombank-sbj mas: bm.qdtg.02a\ncong ty vang bac da quy\nban hanh: ( / /2025)\n‘s odaeseness\nbang gia bac\nhiéu luce tir: 10h50 don vi tinh: vnd/luong\nloa bag cima [cia pan\nbac miéng kim-phie-léc sbj 999 1 ludng 1.860.000 1.908.000",
    "crawled_at": "2025-11-22T16:19:13.015412Z"
  },
  {
    "url": "https://sacombank-sbj.com/blogs/bang-gia-bac/bang-ty-gia-bac-ngay-03-11-2025-bang-4",
    "title": "Bảng Tỷ Giá Bạc - Ngày 03/11/2025 - Bảng 4",
    "date": "2025-11-03",
    "silver_type": "Bạc Miếng Kim-Phúc-Lộc SBJ 999 1 lượng",
    "buy": 1857000,
    "sell": 1905000,
    "effective_time": null,
    "image_url": "https://cdn.hstatic.net/200000315699/file/l4_f401db5fa02542f38bbe0ed28f578ca9.png",
    "ocr_text": "sacombank-sbj ma s6: bm.qdtg.02a\ncong ty vang bac da quy\nban hanh: ( / /2025)\n‘s odaeseness\nbang gia bac\nhiéu luce tir: 10h don vi tinh: vnd/luong\nloa bag cima [cia pan\nbac miéng kim-phie-léc sbj 999 1 ludng 1.857.000 1.905.000",
    "crawled_at": "2025-11-22T16:19:14.601974Z"
  },
  {
    "url": "https://sacombank-sbj.com/blogs/bang-gia-bac/bang-ty-gia-bac-ngay-03-11-2025-bang-3",
    "title": "Bảng Tỷ Giá Bạc - Ngày 03/11/2025 - Bảng 3",
    "date": "2025-11-03",
    "silver_type": "Bạc Miếng Kim-Phúc-Lộc SBJ 999 1 lượng",
    "buy": 1848000,
    "sell": 1896000,
    "effective_time": "09:03",
    "image_url": "https://cdn.hstatic.net/200000315699/file/l3_60489ac84da040e4813a86eb940f69a7_master.png",
    "ocr_text": "sacombank-sbj\ncong ty vang bac da quy\nbang gia bac\nbang: 03 ngay 03/11/2025\nhiéu luce ti: 09h03\nma s6: bm.qdtg.02a\nban hanh: ( / /2025)\ndon vj tinh: vnd/luong\nloal bac /ciamua | giaban\nbac miéng kim-phic-l6c sbj 999 1 luong\n1,848,000\n1,896,000",
    "crawled_at": "2025-11-22T16:19:20.949916Z"
  },
  {
    "url": "https://sacombank-sbj.com/blogs/bang-gia-bac/bang-ty-gia-bac-ngay-03-11-2025-bang-2",
    "title": "Bảng Tỷ Giá Bạc - Ngày 03/11/2025 - Bảng 2",
    "date": "2025-11-03",
    "silver_type": "Bạc Miếng Kim-Phúc-Lộc SBJ 999 1 lượng",
    "buy": 1842000,
    "sell": 1890000,
    "effective_time": "08:25",
    "image_url": "https://cdn.hstatic.net/200000315699/file/l2_74ca1d71f5ae4dcc9770dbd51c4f443b_master.png",
    "ocr_text": "sacombank-sbj mg s6: bm.qdtg.02a\ncong ty vang bac da quy\nban hanh: ( / /2025)\nbang gia bac\nhiéu luce fi: 08h25 bon vj tinh: vnd/luong\nloal bac /ciamua | giaban\nbac miéng kim-phic-l6c sbj 999 1 luong 1,842,000 1,890,000",
    "crawled_at": "2025-11-22T16:19:22.964330Z"
  },
  {
    "url": "https://sacombank-sbj.com/blogs/bang-gia-bac/bang-ty-gia-bac-ngay-03-11-2025-bang-11",
    "title": "Bảng Tỷ Giá Bạc - Ngày 03/11/2025 - Bảng 1",
    "date": "2025-11-03",
    "silver_type": "Bạc Miếng Kim-Phúc-Lộc SBJ 999 luo’ng",
    "buy": 1854000,
    "sell": 1902000,
    "effective_time": "07:30",
    "image_url": "https://cdn.hstatic.net/200000315699/file/hinh_anh_3-11-25_luc_07.21_f17c80df651343109f4ad3b9f1f7d2a5.jpeg",
    "ocr_text": "sacombank-sbj mé s6: bm.qdtg.02a\nsis ban hanh:( / /2025)\nbang gia bac\nbang: 01 ngay 03/11/2025\nhiéu lwe tie: 07h30\nloal bag rs\n1.902.000\ndon vj tinh: vnd/luong\nbac miéng kim-phuc-léc sbj 999 1 luo’ng 1.854.000",
    "crawled_at": "2025-11-22T16:19:24.447192Z"
  },
  {
    "url": "https://sacombank-sbj.com/blogs/bang-gia-bac/bang-ty-gia-bac-ngay-01-11-2025-bang-1",
    "title": "Bảng Tỷ Giá Bạc - Ngày 01/11/2025 - Bảng 1",
    "date": "2025-11-01",
    "silver_type": "Bạc Miếng Kim-Phúc-Lộc SBJ 999 iu’o'ng",
    "buy": 1881000,
    "sell": 1929000,
    "effective_time": "07:30",
    "image_url": "https://cdn.hstatic.net/200000315699/file/hinh_anh_1-11-25_luc_07.14_85b4e1f5bd474339b103cb4cf254f947.jpeg",
    "ocr_text": "sacombank-sbj ma s6: bm.qdtg.02a\ncong ty vang bac da quy\nban hanh: ( / /2025)\nso\n> zz\nbang gia bac\nbang: 01 ngay 01/11/2025\nhiéu luc tiv: 07h30 don vi tinh: vnd/lurorng\nloal bag a\nbac miéng kim-phic-léc sbu 999 1 iu’o'ng 1.881.000 1.929.000",
    "crawled_at": "2025-11-22T16:19:25.903985Z"
  },
  {
    "url": "https://sacombank-sbj.com/blogs/bang-gia-bac/bang-ty-gia-bac-ngay-31-10-2025-bang-9",
    "title": "Bảng Tỷ Giá Bạc - Ngày 31/10/2025 - Bảng 9",
    "date": "2025-10-31",
    "silver_type": "Bạc Miếng Kim-Phúc-Lộc SBJ 999 1 lượng",
    "buy": 1899000,
    "sell": 1947000,
    "effective_time": "15:36",
    "image_url": "https://cdn.hstatic.net/200000315699/file/l9_a0cad8177c1f4041b34df1c5e879d9f3_master.png",
    "ocr_text": "sacombank-sbj ma s6: bm.qdtg.02a\ncong ty vang bac da quy\nban hanh: ( / /2025)\nbang gia bac\nhiéu lue fu: 15h36 bon vj tinh: vnd/luong\nloal bac /ciamua | giaban\nbac miéng kim-phic-l6c sbj 999 1 luong 1,899,000 1,947,000",
    "crawled_at": "2025-11-22T16:19:27.636447Z"
  },
  {
    "url": "https://sacombank-sbj.com/blogs/bang-gia-bac/bang-ty-gia-bac-ngay-31-10-2025-bang-8",
    "title": "Bảng Tỷ Giá Bạc - Ngày 31/10/2025 - Bảng 8",
    "date": "2025-10-31",
    "silver_type": "Bạc Miếng Kim-Phúc-Lộc SBJ 999 1 lượng",
    "buy": 1902000,
    "sell": 1950000,
    "effective_time": "14:43",
    "image_url": "https://cdn.hstatic.net/200000315699/file/l8_3944c12085174fa587bb44c594cdc280_master.png",
    "ocr_text": "sacombank-sbj ma s6: bm.qdtg.02a\ncong ty vang bac da quy\nban hanh: ( / /2025)\nbang gia bac\nhiéu lue fu: 14h43 bon vj tinh: vnd/luong\nloal bac /ciamua | giaban\nbac miéng kim-phic-l6c sbj 999 1 luong 1,902,000 1,950,000",
    "crawled_at": "2025-11-22T16:19:29.931441Z"
  },
  {
    "url": "https://sacombank-sbj.com/blogs/bang-gia-bac/bang-ty-gia-bac-ngay-31-10-2025-bang-7",
    "title": "Bảng Tỷ Giá Bạc - Ngày 31/10/2025 - Bảng 7",
    "date": "2025-10-31",
    "silver_type": "Bạc Miếng Kim-Phúc-Lộc SBJ 999 1 lượng",
    "buy": 1893000,
    "sell": 1941000,
    "effective_time": "13:46",
    "image_url": "https://cdn.hstatic.net/200000315699/file/l7_d3f358c94ac847a290eaa0d045a948a0_master.png",
    "ocr_text": "sacombank-sbj ma s6: bm.qdtg.02a\ncong ty vang bac da quy\nban hanh: ( / /2025)\nbang gia bac\nhiéu lue fu: 13h46 bon vj tinh: vnd/luong\nloal bac /ciamua | giaban\nbac miéng kim-phic-l6c sbj 999 1 luong 1,893,000 1,941,000",
    "crawled_at": "2025-11-22T16:19:34.411246Z"
  },
  {
    "url": "https://sacombank-sbj.com/blogs/bang-gia-bac/bang-ty-gia-bac-ngay-31-10-2025-bang-6",
    "title": "Bảng Tỷ Giá Bạc - Ngày 31/10/2025 - Bảng 6",
    "date": "2025-10-31",
    "silver_type": "Bạc Miếng Kim-Phúc-Lộc SBJ 999 1 lượng",
    "buy": 1884000,
    "sell": 1932000,
    "effective_time": "13:17",
    "image_url": "https://cdn.hstatic.net/200000315699/file/l6_3fe4ac1966134105b75fd36736b229e1_master.png",
    "ocr_text": "sacombank-sbj ma s6: bm.qdtg.02a\ncong ty vang bac da quy\nban hanh: ( / /2025)\nbang gia bac\nhiéu luce fi: 13h17 bon vj tinh: vnd/luong\nloal bac /ciamua | giaban\nbac miéng kim-phic-l6c sbj 999 1 luong 1,884,000 1,932,000",
    "crawled_at": "2025-11-22T16:19:37.209809Z"
  },
  {
    "url": "https://sacombank-sbj.com/blogs/bang-gia-bac/bang-ty-gia-bac-ngay-31-10-2025-bang-5",
    "title": "Bảng Tỷ Giá Bạc - Ngày 31/10/2025 - Bảng 5",
    "date": "2025-10-31",
    "silver_type": "Bạc Miếng Kim-Phúc-Lộc SBJ 999 1 lượng",
    "buy": 1875000,
    "sell": 1923000,
    "effective_time": "10:19",
    "image_url": "https://cdn.hstatic.net/200000315699/file/l5_f4c764073d094b62a4761f3699283928_master.png",
    "ocr_text": "sacombank-sbj mé 86: bm.qdtg.02a\ncong ty vang bac da quy\nban hanh: ( / /2025)\nbang gia bac\nhiéu luce fu: 10h19 bon vj tinh: vnd/luong\nloal bac /ciamua | giaban\nbac miéng kim-phic-l6c sbj 999 1 luong 1,875,000 1,923,000",
    "crawled_at": "2025-11-22T16:19:38.661590Z"
  },
  {
    "url": "https://sacombank-sbj.com/blogs/bang-gia-bac/bang-ty-gia-bac-ngay-31-10-2025-bang-4",
    "title": "Bảng Tỷ Giá Bạc - Ngày 31/10/2025 - Bảng 4",
    "date": "2025-10-31",
    "silver_type": "Bạc Miếng Kim-Phúc-Lộc SBJ 999 1 lượng",
    "buy": 1881000,
    "sell": 1929000,
    "effective_time": "09:17",
    "image_url": "https://cdn.hstatic.net/200000315699/file/l4_2e3fe15f40ce4412b4a7168f2f106742_master.png",
    "ocr_text": "sacombank-sbj mg s6: bm.qdtg.02a\ncong ty vang bac da quy\nban hanh: ( / /2025)\nbang gia bac\nhiéu luce fu: o9h17 bon vj tinh: vnd/luong\nloal bac /ciamua | giaban\nbac miéng kim-phic-l6c sbj 999 1 luong 1,881,000 1,929,000",
    "crawled_at": "2025-11-22T16:19:40.037233Z"
  },
  {
    "url": "https://sacombank-sbj.com/blogs/bang-gia-bac/bang-ty-gia-bac-ngay-31-10-2025-bang-3",
    "title": "Bảng Tỷ Giá Bạc - Ngày 31/10/2025 - Bảng 3",
    "date": "2025-10-31",
    "silver_type": "Bạc Miếng Kim-Phúc-Lộc SBJ 999 1 lượng",
    "buy": 1875000,
    "sell": 1923000,
    "effective_time": "08:48",
    "image_url": "https://cdn.hstatic.net/200000315699/file/l3_aeeedd35cb6a4f71b984560bf923131e_master.png",
    "ocr_text": "sacombank-sbj ma s6: bm.qdtg.02a\ncong ty vang bac da quy\nban hanh: ( / /2025)\nbang gia bac\nhiéu lue fu: 08h48 bon vj tinh: vnd/luong\nloal bac /ciamua | giaban\nbac miéng kim-phic-l6c sbj 999 1 luong 1,875,000 1,923,000",
    "crawled_at": "2025-11-22T16:19:41.681263Z"
  },
  {
    "url": "https://sacombank-sbj.com/blogs/bang-gia-bac/bang-ty-gia-bac-ngay-31-10-2025-bang-2",
    "title": "Bảng Tỷ Giá Bạc - Ngày 31/10/2025 - Bảng 2",
    "date": "2025-10-31",
    "silver_type": "Bạc Miếng Kim-Phúc-Lộc SBJ 999 luro‘ng .872.000",
    "buy": 1872000,
    "sell": 1920000,
    "effective_time": "08:20",
    "image_url": "https://cdn.hstatic.net/200000315699/file/hinh_anh_31-10-25_luc_08.16_fd34a93a02164983bccc4cf34727e544.jpeg",
    "ocr_text": "sacombank-sbj ma s6: bm.qdtg.02a\nban hanh: ( / /2025)\n> 4\nbang gia bac\nbang: 02 ngay 31/10/2025\nhiéu luc tiv: 08h20 don vi tinh: vnd/uong\nbac miéng kim-phtic-léc sbj 999 1 luro‘ng 1.872.000 | 1.920.000",
    "crawled_at": "2025-11-22T16:19:47.820084Z"
  },
  {
    "url": "https://sacombank-sbj.com/blogs/bang-gia-bac/bang-ty-gia-bac-ngay-31-10-2025-bang-10",
    "title": "Bảng Tỷ Giá Bạc - Ngày 31/10/2025 - Bảng 10",
    "date": "2025-10-31",
    "silver_type": "Bạc Miếng Kim-Phúc-Lộc SBJ 999 1 lượng",
    "buy": 1887000,
    "sell": 1935000,
    "effective_time": "16:25",
    "image_url": "https://cdn.hstatic.net/200000315699/file/l10_a549542d24bf411bbef2febfa224a817_master.png",
    "ocr_text": "sacombank-sbj ma s6: bm.qdtg.02a\ncong ty vang bac da quy\nban hanh: ( / /2025)\nbang gia bac\nhiéu luce fu: 16h25 bon vj tinh: vnd/luong\nloal bac /ciamua | giaban\nbac miéng kim-phic-l6c sbj 999 1 luong 1,887,000 1,935,000",
    "crawled_at": "2025-11-22T16:19:49.247536Z"
  },
  {
    "url": "https://sacombank-sbj.com/blogs/bang-gia-bac/bang-ty-gia-bac-ngay-31-10-2025-bang-1",
    "title": "Bảng Tỷ Giá Bạc - Ngày 31/10/2025 - Bảng 1",
    "date": "2025-10-31",
    "silver_type": "Bạc Miếng Kim-phtc-Lộc SBJ 999 iu’o’ng",
    "buy": 1869000,
    "sell": 1917000,
    "effective_time": "07:30",
    "image_url": "https://cdn.hstatic.net/200000315699/file/hinh_anh_31-10-25_luc_07.20_e61c4208d153444698dfcb6797d0281c.jpeg",
    "ocr_text": "sacombank-sbj m& s6: bm.qdtg.02a\ncong ty vang bac da quy ban hanh: ( / /2025)\nbang gia bac\nbang: 01 ngay 31/10/2025\nhiéu luc tir: 07h30\nloa bac [_cimua | giaban\nbac miéng kim-phtc-léc sbj 999 1 iu’o’ng 1.869.000 1.917.000\ndon vj tinh: vndaugng",
    "crawled_at": "2025-11-22T16:19:50.507007Z"
  },
  {
    "url": "https://sacombank-sbj.com/blogs/bang-gia-bac/bang-ty-gia-bac-ngay-30-10-2025-bang-9",
    "title": "Bảng Tỷ Giá Bạc - Ngày 30/10/2025 - Bảng 9",
    "date": "2025-10-30",
    "silver_type": "Bạc Miếng Kim-Phúc-Lộc SBJ 999 1 lượng",
    "buy": 1848000,
    "sell": 1896000,
    "effective_time": "16:18",
    "image_url": "https://cdn.hstatic.net/200000315699/file/l9_02e48a00cb1043c686b30eab62bbd9b3_master.png",
    "ocr_text": "sacombank- sbj mg s6: bm.qdtg.02a\ncong ty vang bac da quy\nban hanh: ( / /2025)\nbang gia bac\nhiéu lue fu: 16h18 bon vj tinh: vnd/luong\nloal bac cima | giaban\nbac miéng kim-phiic-l6c sbj 999 1 luong 1,848,000 1,896,000",
    "crawled_at": "2025-11-22T16:19:51.972074Z"
  },
  {
    "url": "https://sacombank-sbj.com/blogs/bang-gia-bac/bang-ty-gia-bac-ngay-30-10-2025-bang-8",
    "title": "Bảng Tỷ Giá Bạc - Ngày 30/10/2025 - Bảng 8",
    "date": "2025-10-30",
    "silver_type": "Bạc Miếng Kim-Phúc-Lộc SBJ 999 1 lượng",
    "buy": 1842000,
    "sell": 1890000,
    "effective_time": "15:53",
    "image_url": "https://cdn.hstatic.net/200000315699/file/l8_2ea37463c929478f98aa14b386240485_master.png",
    "ocr_text": "sacombank- sbj mg s6: bm.qdtg.02a\ncong ty vang bac da quy\nban hanh: ( / /2025)\nbang gia bac\nhiéu lue fu: 15h53 bon vj tinh: vnd/luong\nloal bac cima | giaban\nbac miéng kim-phiic-l6c sbj 999 1 luong 1,842,000 1,890,000",
    "crawled_at": "2025-11-22T16:19:53.478898Z"
  },
  {
    "url": "https://sacombank-sbj.com/blogs/bang-gia-bac/bang-ty-gia-bac-ngay-30-10-2025-bang-7",
    "title": "Bảng Tỷ Giá Bạc - Ngày 30/10/2025 - Bảng 7",
    "date": "2025-10-30",
    "silver_type": "Bạc Miếng Kim-Phúc-Lộc SBJ 999 1 lượng",
    "buy": 1839000,
    "sell": 1887000,
    "effective_time": "14:22",
    "image_url": "https://cdn.hstatic.net/200000315699/file/l7_cbb8298d23064aea89d36e6557363928.png",
    "ocr_text": "sacombank-sbj\ncong ty vang bac ba quy\nbang gia bac\nbang: 07 ngay 30/10/2025\nhiéu luc ta 14h22\nm 86: bm.qdtg.02a\nban hanh: ( / /2025)\ndon vj tinh: vnd/lugng\n(oat bac fcrmua [cia ban\nbac miéng kim-phic-léc sbj 999 1 ludng\n1.839.000\n1.887.000",
    "crawled_at": "2025-11-22T16:19:56.144168Z"
  },
  {
    "url": "https://sacombank-sbj.com/blogs/bang-gia-bac/bang-ty-gia-bac-ngay-30-10-2025-bang-6",
    "title": "Bảng Tỷ Giá Bạc - Ngày 30/10/2025 - Bảng 6",
    "date": "2025-10-30",
    "silver_type": "Bạc Miếng Kim-Phúc-Lộc SBJ 999 1 lượng",
    "buy": 1833000,
    "sell": 1881000,
    "effective_time": "13:18",
    "image_url": "https://cdn.hstatic.net/200000315699/file/l6_f644a31858504aa38e076fa644714d75.png",
    "ocr_text": "sacombank-sbj mas6: bm.qdtg.02a\nban hanh: ( / /2025)\naw,\nsol.. cece\nbang gia bac\nhiéu luce ti: 13h18 don vj tinh: vnd/luong\n(oal bac ff cmua | clasan\nbac miéng kim-phuc-léc sbj 999 1 luong 1.833.000 1.881.000",
    "crawled_at": "2025-11-22T16:19:57.375092Z"
  },
  {
    "url": "https://sacombank-sbj.com/blogs/bang-gia-bac/bang-ty-gia-bac-ngay-30-10-2025-bang-5",
    "title": "Bảng Tỷ Giá Bạc - Ngày 30/10/2025 - Bảng 5",
    "date": "2025-10-30",
